,date,text
125,"Oct 15, 2022",Knocktober is in full swing! Thank you to the SWPA Grassroots coalition for organizing multiple canvasses across #PA17 today. We’re feeling the momentum!
126,"Oct 15, 2022","Kicked the day off with 
@AlleghenyLabor
 + 
@dc57iupat
 members to knock some doors. On to November! #PA17"
127,"Oct 14, 2022",“You want to solve our country’s problems? Don’t send another out of touch corporate executive. Send Deluzio.”
128,"Oct 14, 2022","I spent time today with members of 
@ATU_Local85
, who I’m so proud to have backing me in #PA17. 

Send me to Washington, and I’ll always fight for union rights, our infrastructure, and to strengthen our regional transit."
129,"Oct 14, 2022","Jeremy Shaffer is showing you exactly who he is: Campaigning with insurrectionists, courting endorsements from extremists, and begging for money from the radical right."
130,"Oct 13, 2022","Feeling the love in Beaver tonight! #TeamDeluzio is meeting with voters across #PA17, who love this country, who are committed to fighting for this democracy of ours and our freedom."
131,"Oct 13, 2022","We have a clear contrast in #PA17. The other guy wants to ban abortion (even for rape/incest victims), to take away your freedom to make your own decisions about your family and your healthcare. Jeremy Shaffer is too extreme for many in his own party and a threat to your rights."
132,"Oct 13, 2022","Great to spend some time at 
@RMU
 today speaking with political science students about their future in #PA17. Thanks for the insightful questions!"
133,"Oct 13, 2022","This is a campaign for our common good. And I'll keep fighting to protect and expand Social Security from right-wing attacks, so everyone can retire with the dignity they've earned."
134,"Oct 13, 2022","Happy birthday to the 
@USNavy
 and every Sailor who's worn the uniform, who can say with great pride that they served in the world's greatest Navy. I'm proud to call you shipmates!"
135,"Oct 12, 2022","It was great to hear from so many #PA17 voters at tonight’s 
@IBEW
 Local 29 meeting. Proud to have their endorsement and support in the fight for our common good!"
136,"Oct 12, 2022","It was great to spend time talking with really sharp new and future voters at Moon High School this morning.

The future of #PA17 is bright!"
137,"Oct 12, 2022","Doug Mastriano's bigotry, this antisemitism, is disgusting. It's a vile insult to our Jewish neighbors. And politicians who remain silent in the face of this hate have no place representing #PA17."
138,"Oct 11, 2022","The energy in the room for tonight's 
@EASCarpenters
 union rally was real. Working families are fired up to fight right here in #PA17 for the union way of life. Couldn’t be prouder to have your support!"
139,"Oct 11, 2022","Jeremy Shaffer would love for you to forget that he would be ""honored"" to get Trump's endorsement. 

Shameful stuff."
140,"Oct 11, 2022","The labor movement gave us Social Security, overtime pay, and weekends. And we know that strong unions lead to greater prosperity and freedom for our entire community. So I couldn't be prouder to be the union-backed candidate in the race for #PA17."
141,"Oct 10, 2022","It's been a while since I bowled as a kid in a league at Crafton Ingram Lanes, but it was great as always to be there tonight.

#TeamDeluzio had an awesome night over bowling, beer, and pop—and we're ready to win in November! #PA17"
142,"Oct 10, 2022","No politician should tell you how to plan your family. I'm in this race to defend and expand our community's freedom, and that includes keeping right-wing politicians out of the way of women's reproductive decisions. #PA17"
143,"Oct 10, 2022","Rep. Tony DeLuca’s life of service was admirable, and his dedication to his community—Penn Hills, Verona, and beyond—and this Commonwealth was all too rare. 

I send my condolences to Tony’s family and friends, who I’m keeping in my thoughts and prayers. He’ll be missed."
144,"Oct 10, 2022","Happy birthday to the 
@NavalAcademy
 from this proud alum! I learned a lot during my four years at Annapolis, preparing to lead Americans in harm's way, and one lesson remains core to who I am today: ""Ship. Shipmate. Self.”"
145,"Oct 10, 2022",Take on the price-gouging corporate predators + get 'em to finally pay some taxes + shorten supply chains to make more stuff in Western PA = lower cost of living for the working families of #PA17
146,"Oct 9, 2022","You want 'em, we have 'em! 

Show your #TeamDeluzio pride and sign up to get your yard sign today: https://mobilize.us/chrisforpa/event/526709/"
147,"Oct 9, 2022",#HereWeGo
148,"Oct 9, 2022","We are less than a month from Election Day, and our momentum in #PA17 can't be stopped! Great morning with voters in Green Tree who are standing together to fight for our common good."
149,"Oct 8, 2022","From Moon to Aspinwall to Dormont and the 
@CrusadersFball
 game, we aren't slowing down with 30 days left to vote! #PA17"
150,"Oct 8, 2022","China is our economic adversary, plain and simple. And we need people in Congress who understand the threat China poses to our prosperity and global security, lessons I learned leading Americans in uniform. [1/3]"
151,"Oct 8, 2022","I'm glad to see our government standing up to China and the corporations serving the Communist regime just to make a buck. Corporations like the one that made Jeremy Shaffer rich, that have been raking in millions building up China's infrastructure. [2/3]"
152,"Oct 8, 2022",We should be holding these executives accountable—we definitely don't need them in Congress. #PA17
153,"Oct 8, 2022","Whether it's in the face of an anti-worker Supreme Court, union busters, or anti-union politicians, I'll always have organized labor's back in a fight. ✊ 
@Teamsters"
154,"Oct 8, 2022",Coraopolis Fall Festival is a great #PA17 community event today—check it out! Always nice to talk to folks in Cory and thanks to Mayor Michael Dixon for being a great host!
155,"Oct 8, 2022","No better way to kick off a union weekend of action than with 
@AlleghenyLabor
 at the 
@steelworkers
! These folks are fired up, ready to fight for our common good, and knock doors across #PA17 today. ✊"
156,"Oct 7, 2022",This one never gets old...
157,"Oct 7, 2022","It was an honor to fire up volunteers in the North Hills alongside 
@JoshShapiroPA
, 
@AustinDavisPA
, 
@SenWilliamsPA
, and 
@VenkatforPA
. Folks are ready to defend our freedom and elect Democrats up and down the ballot this year. Let's win this! #PA17"
158,"Oct 7, 2022","31 DAYS LEFT TO VOTE. Ballots are arriving in mail boxes and voting is happening now --> Nov. 8th. #TeamDeluzio needs to reach as many voters as possible in these next 31 days, and we need your help. Sign up today! https://mobilize.us/chrisforpa/"
159,"Oct 7, 2022","I stand with these Post-Gazette workers. 16 years without a raise is the epitome of greed from the owners, who have tarnished the legacy of a great newspaper. I won’t be crossing the picket line for any interviews with the PG 
@CWAUnion
 
@Teamsters"
160,"Oct 7, 2022","Our next Governor 
@JoshShapiroPA
 is spot on. The 
@Boilermakers154
 have endorsed Republicans over the years, but I’m proud to have their endorsement for Congress. They know that support for their workers is a heck of a lot more important than your party. Thank you!"
161,"Oct 6, 2022","These brave men and women put their lives on the line every day to keep folks safe—no surprise 
@PghFireFighters
 are going above and beyond to help victims of Hurricane Ian."
162,"Oct 6, 2022","Jeremy Shaffer doesn't want you to know that he's made millions from a company that builds infrastructure in China. 

Let's check out the CEO (a Shaffer donor) and others brag about their Communist China business on a recent earnings call: https://fool.com/earnings/call-transcripts/2022/08/09/bentley-systems-incorporated-bsy-q2-2022-earnings/"
163,"Oct 6, 2022","Chris Deluzio is running in PA-17 to defend democracy, take on corporate interests, and defend the union way of life. If you’re in Allegheny or Beaver County, make sure to support 
@ChrisForPA
 this November!"
164,"Oct 6, 2022","It was a great morning alongside Senator 
@SherrodBrown
, Senator 
@Bob_Casey
, and LG 
@JohnFetterman
 in Beaver County to rally with labor. 

This crew is ready to win the fight in November to protect union jobs, make more stuff right here in #PA17, and take on corporate greed."
165,"Oct 6, 2022","✅Stop relying on far-flung supply chains 
✅Bring more manufacturing back to #PA17 
✅Make stuff with union workers 
✅Drive down costs for families"
166,"Oct 6, 2022","I am so proud of the broad coalition of grassroots support powering this campaign. Together, we are sending a clear message: #PA17 wants someone to fight for working families and union members, not corporations and billionaires."
167,"Oct 5, 2022","We all know that China is our economic adversary. 

I wore the uniform & led Americans at sea to keep Communist China at bay. 

My opponent? He made millions from a corporation building infrastructure in China. We can't trust these corporate executives who've sold out western PA."
168,"Oct 5, 2022",It’s a beautiful afternoon for the Bellevue Farmers Market—a #PA17 neighborhood gem!
169,"Oct 5, 2022",These guys are both on record wanting to ban abortion and were thrilled when the Supreme Court overturned Roe v. Wade. Too extreme for Pennsylvania. #PA17
170,"Oct 4, 2022",#TeamDeluzio has been meeting with voters across #PA17 and feeling the momentum heading into these final 5 weeks. Tonight in Beaver County was no exception!
171,"Oct 4, 2022",Wishing all those observing #YomKippur a meaningful time of reflection and an easy fast. G’mar Chatima Tovah!
172,"Oct 4, 2022","I was willing to die for this country, so you know I'll fight like hell to protect our fundamental rights, including the right to an abortion. #PA17"
173,"Oct 4, 2022","When I took the oath of office as a 17-year old, I swore to protect & defend this country. That commitment & my love of country still drive me today. It's why I am asking folks to send me to DC to serve all of us yet again. I will always put our common good and western PA first."
174,"Oct 3, 2022","Chris Geronimos is spot on: ""This fall, it’s crucial that we elect allies in every level of government who are focused on creating family-sustaining career pathways for all Pennsylvanians."" [1/2]"
175,"Oct 3, 2022","And I couldn't be prouder to have support from Chris and the 
@dc57iupat
 members he's leading. They know I'll be fighting to support #PA17 union apprenticeship programs. [2/2]"
176,"Oct 3, 2022","I had some great conversations over breakfast this morning with members of PFT Local 400R. Teachers are so critical to our kids and our communities, and I'm honored to have 
@AFTPA
, 
@PSEA
, and 
@PFT400
 backing this #PA17 campaign. Thank you!"
177,"Oct 3, 2022","Jeremy Shaffer is already working with extremists like Mastriano to strip away reproductive freedom. I've been committed to defending our Constitution since my days in uniform, and I'll always fight to protect your rights from these attacks."
178,"Oct 3, 2022","We have to be ready for these attacks and efforts to weaken our democracy from right-wing election deniers and conspiracy theorists. I know that folks in #PA17 (whether Democrat, Republican, or Independent) refuse to let these extremists win."
179,"Oct 2, 2022","Here he goes again, telling us exactly who he is. More campaign merch that isn't union-printed. Talk is cheap, Jeremy. Stop undercutting #PA17 union workers just to save a buck."
180,"Oct 2, 2022","(And I know you’re not from here, Jeremy, so let me help ya out as a #PA17 native: we say “Pitt” Panthers—not “Pittsburgh” Panthers. #H2P)"
181,"Oct 2, 2022","Well, another tough loss for the Steelers, but my kids found some joy in pumpkin picking and farm fun today! #PA17"
182,"Oct 2, 2022","Despite the weather, #TeamDeluzio is putting the work in! Shout out to all of our amazing volunteers across #PA-17 who are fighting for our common good."
183,"Oct 2, 2022",Union coffee is the best coffee. ☕️
184,"Oct 1, 2022","Forest Hills may be new to #PA17, but they're ready to fight for our common good. #TeamDeluzio is knocking on doors across the district every day, sign up to join us in your community: https://mobilize.us/chrisforpa/"
185,"Oct 1, 2022",Go Navy! Beat Air Force!
186,"Oct 1, 2022","Jeremy Shaffer shares a #PA17 campaign office with this man. The Mastriano-Shaffer radical right is way too extreme for western PA, and we'll prove it in November."
187,"Sep 30, 2022",Our biggest fundraising deadline of the year is midnight tonight — can you chip in and help us beat the huge corporate jag-offs? https://secure.actblue.com/donate/chris-deluzio-for-congress-social
188,"Sep 30, 2022","From the factory floor to the coffee shop, #TeamDeluzio is honored to have support from every corner of the western PA labor movement. 

I'll always fight to lift up #PA17 workers and protect local jobs from corporate raiders and anti-union attacks."
189,"Sep 30, 2022","#TeamDeluzio will be hitting every corner of #PA17 this weekend, all across Allegheny and Beaver Counties. People are fired up to fight for the common good. Will you join us? https://mobilize.us/chrisforpa/"
190,"Sep 30, 2022","My opponent is “honored” to be endorsed by a guy who tried to kill hard-earned benefits for veterans like me exposed to burn pits in Iraq, Afghanistan, etc. Pat Toomey’s betrayal of us veterans is something we’ll never forget. Disgraceful."
191,"Sep 29, 2022",A new and modern terminal at the airport will serve our region well and boost our economy. I'm excited about the work (and jobs!) we're seeing. We should have the best infrastructure in the world & I'll always fight in Washington to deliver it for #PA17.
192,"Sep 29, 2022","I don't think the richest billionaires in history should pay a lower tax rate than you. Pretty basic stuff, folks. 

And when I'm the next #PA17 Congressman, I'll fight to get these billionaires and huge corporations to pay their fair share in taxes."
193,"Sep 29, 2022","So many great #PA17 breweries for folks to enjoy. Some of my personal favorites are Grist House, Dancing Gnome, Fermata, Hitchhiker, and Cobblehaus. 

But I gotta tell ya…nothing beats a cold Iron! 🍻"
194,"Sep 29, 2022","Happy #VFWDay from this proud VFW member! And thanks for all that you do for us veterans, service members, and our families."
195,"Sep 28, 2022","A picture worth a thousand words. 

Doug Mastriano proudly participated in the insurrection to overthrow our government, and my opponent welcomes endorsements and support from these people (even Trump). Too dangerous for #PA17."
196,"Sep 28, 2022","Honored to be endorsed by 
@NARAL
. You'll always know where I stand on protecting your freedom to choose. And I'm going to fight hard to protect you from extremists like Doug Mastriano and my opponent and their plans to attack your rights."
197,"Sep 28, 2022",The Inflation Reduction Act will provide working people with billions in savings by allowing Medicare to negotiate drug prices (finally!). [1/2]
198,"Sep 28, 2022",But the Big Pharma-backed House Republicans & my opponent can't wait to reverse this b/c they care way more about juicing corporate profits than protecting Seniors. So let's make sure we beat 'em here in #PA17 on November 8! [2/2]
199,"Sep 27, 2022","42 days until Election Day! Mail ballots will start arriving in homes in a matter of days, and #TeamDeluzio is sprinting to the finish. 

Volunteer today (and you can get your own union-made Deluzio shirt!): https://mobilize.us/chrisforpa/"
200,"Sep 27, 2022","One thing I regularly hear from #PA17 voters: they want a healthy democracy. Folks are tired of the conspiracy theories, the chaos, the Jan. 6 violence. [1/2]"
201,"Sep 27, 2022","I've been committed to defending our Constitution since I took the oath as a 17-year old, and my resolve to defend America and our freedom has only grown. [2/2]"
202,"Sep 27, 2022","My opponent is on record supporting a constitutional amendment to ban abortion, even in cases of rape and incest. He'd happily work with his extremist allies like Doug Mastriano to strip away your personal freedoms."
203,"Sep 27, 2022","Gutting Social Security & Medicare, banning abortion, letting Big Pharma rip you off at the pharmacy, & so much more: the MAGA-Shaffer agenda is wrong for #PA17."
204,"Sep 26, 2022","While my corporate executive opponent was chasing his millions, I was serving in uniform to keep this country safe. 

Stepping up after this country was attacked on 9/11 was an easy choice for me, because those are the values I learned growing up right here in #PA17."
205,"Sep 26, 2022",Happy Monday to everyone except corporate executives who sell out American workers to save a buck on cheap campaign merch!
206,"Sep 26, 2022",#PA17 rocks hard. Great stuff!
207,"Sep 26, 2022","#TeamDeluzio doesn't run on corporate fortunes or gifts from the Koch brothers. We're powered by a movement of working people across #PA17. If you can manage, please support our fight. https://secure.actblue.com/donate/chris-deluzio-for-congress-social"
208,"Sep 25, 2022","Grateful as always to the awesome #TeamDeluzio volunteers who knocked doors, made calls, sent postcards, and fought for the common good all over #PA17 this weekend. 

Will you join us?
https://mobilize.us/chrisforpa/"
209,"Sep 25, 2022","Congrats to former Penn Hills standout and #PA17 legend 
@AaronDonald97
!"
210,"Sep 25, 2022",Thanks to some wonderful folks in Chippewa for hosting a meet and greet for #TeamDeluzio this afternoon. Got to see some old friends and make some new ones! #PA17
211,"Sep 25, 2022",So many fired up volunteers this morning at the Blue Victory Brunch in Allison Park. #TeamDeluzio is ready for the final stretch! #PA17
212,"Sep 25, 2022",Wishing all who celebrate a peaceful and joyful Rosh Hashanah. Shanah Tovah!
213,"Sep 25, 2022","#TeamDeluzio started the morning at the Shaler Area Backpack Initiative, which provides food for students experiencing food insecurity to take home on the weekends. Inspiring to see #PA17 neighbors helping each other out. 
@LindseyForPA"
214,"Sep 24, 2022",Our listening session in Penn Hills was a great time to hear from voters about what they expect from their next #PA17 Congressman. Delivering for western PA & standing up for our democracy against the insurrectionists supporting my corporate executive opponent were top of mind.
215,"Sep 24, 2022",#TeamDeluzio is meeting voters across the district today—kicking things off in Ben Avon and Ambridge. Across #PA17 we are hearing the same thing: life is too expensive and corporate price gouging has to stop.
216,"Sep 24, 2022",I'm running to hold the corporate bad actors accountable and start making more stuff right here in western PA.
217,"Sep 24, 2022",The positive reaction to our latest ad has been overwhelming -- and I can't thank you enough for your support. But we need the money to stay on the air to keep getting our message out. Can you chip in today to help? https://secure.actblue.com/donate/chris-deluzio-for-congress-social
218,"Sep 23, 2022","🇺🇸 Let's make stuff here again with union workers. 
👊Let's take on huge corporate price gouging. 
👍Let's put #PA17 working families first."
219,"Sep 23, 2022","I stepped up to serve our country in uniform because I believe deeply in what America is and can be. In Congress, I've committeed to joining the For Country Caucus alongside veterans from both parties, driven by that same belief in America. [1/2]"
220,"Sep 23, 2022",I know we're strongest when we fight together for our common good. #PA17 [2/2]
221,"Sep 23, 2022","Corporate execs like the guy I'm running against just LOVE screwing over American workers. Heck, lousy trade deals & cheap foreign labor have made them $$$. Enough already. Let's make stuff here with strong union jobs & bring our supply chains back home🇺🇸"
222,"Sep 23, 2022",This union town is ready for Pickett. #HereWeGo
223,"Sep 22, 2022","Raise your hand if: 
✅your private equity investments got $1M+ in PPP loans forgiven
✅you're funding your campaign from the fortune you made at a corporate giant building stuff in China & all over the planet
✅you've pledged to never raise taxes on billionaires & huge corps"
224,"Sep 22, 2022","It's an honor to be the union-backed campaign in the race for #PA17 and have the support of union workers across the district. Thanks 
@EASCarpenters
 and Local #432 members—I’ll always fight for your jobs and the union way of life."
225,"Sep 22, 2022","I'm proud to have earned the endorsement of the hardworking folks of 
@SEIUPA
. On the campaign trail and in Congress, I'll be fighting to protect the union way of life in western PA. #PA17 #1u"
226,"Sep 22, 2022","I believe every person deserves to make their own decisions when it comes to their healthcare and planning a family. My opponent wants government to control your body by banning abortion, even for victims of rape and incest."
227,"Sep 21, 2022","We had a great crowd tonight in Mt. Lebanon. One thing I hear across #PA17 is fear about the future of our democracy. I’ve protected it in uniform, and I’m ready to fight for it in Congress — and unlike my opponent, you’ll see no insurrectionists endorsing my campaign."
228,"Sep 21, 2022","Remember that time Jeremy Shaffer tried to get Trump's endorsement and said he'd ""definitely be honored"" to have his endorsement? Ya know, the guy who tried to overthrow our government and the Constitution...just disgraceful and pathetic stuff."
229,"Sep 21, 2022","Corporate profits continue to hit record highs while the working people of western PA get screwed. We don't just have a supply chain problem, we have a corporate greed problem. I'm ready to fight the price-gouging big businesses ripping us off."
230,"Sep 21, 2022","I’m always so impressed with the hardworking folks who take care of my fellow veterans and me at the VA. Today’s flu shot was no exception! 

When I’m your Congressman, I’ll fight for our country to keep the sacred promise to care for every single veteran who stepped up to serve."
231,"Sep 20, 2022","I believe in something pretty simple: make more stuff here at home. No more lousy trade deals, no more undercutting western PA workers with anti-union laws, no more coddling our economic adversaries abroad. 🇺🇸"
232,"Sep 20, 2022","What do McCarthy, Scalise, and Stefanik have in common? 
-tried to overthrow the 2020 election
-want to cut your Social Security/Medicare
-trying to ban abortion
-backing my corporate executive opponent in #PA17"
233,"Sep 20, 2022","Here's my corporate executive opponent, in writing, saying the government has no role in making sure you have healthcare. 

Seniors: think your Medicare benefits are safe with him? 

How about our VA benefits, fellow veterans? Me neither."
234,"Sep 20, 2022","#TeamDeluzio has a new ad on the air! 

In Congress, I'm going to fight to make stuff in #PA17, create new union jobs, protect our rights, and secure America’s future. Can you chip in today to help us stay on the air?https://secure.actblue.com/donate/chris-deluzio-for-congress-social"
235,"Sep 19, 2022","This election, our rights are on the ballot. I was willing to risk my life to protect them, and in Congress I'll fight these insane right-wing attacks on our freedoms."
236,"Sep 19, 2022","I will fight in Congress for every American's right to form and join a union, starting with the PRO Act ✊"
237,"Sep 19, 2022","Spent some time today with Fox Chapel High School students talking about our government and the future they deserve. 

I know they’re ready to fight for it! Thanks for having me!"
238,"Sep 19, 2022","I’m damn proud that these crooked billionaires are scared of #TeamDeluzio. When the Koch brothers and their dark money come at you, you must be doing something right. #PA17"
239,"Sep 18, 2022",#TeamDeluzio was hitting the doors and the streets hard today. Thanks to all the awesome volunteers powering this fight for our common good.
240,"Sep 18, 2022",Shaking off the Steelers loss and closing out a long weekend on the campaign trail with a family hike in Fall Run Park. Our #PA17 parks are an absolute treasure!
241,"Sep 17, 2022",Wilkinsburg Community Day was a lot of fun. Folks are ready to take this fight for our common good to the finish line in November! #PA17
242,"Sep 17, 2022","It may not feel like Fall today, but Green Tree Octoberfest was a hit!"
243,"Sep 17, 2022",The path to holding the majority in Congress runs right through #PA17. Feeling the love today in Dormont and Mt. Lebanon — volunteers are fired up and knocking doors!
244,"Sep 17, 2022","Fueled up for a day on the #PA17 trail at 
@bcdemparty
’s Doughnuts with Dems event this morning. Folks are fired up!"
245,"Sep 16, 2022","Great to see so many friends in the Building Trades today in Beaver County. We have the best union workforce in the world right here in #PA17, and we’re ready to get to work. ✊"
246,"Sep 16, 2022","For too long, the workers of western PA have been screwed over by anti-union policies and trade deals that killed local jobs & manufacturing. It's time to make stuff right here with strong union jobs. I'm on the side of working families in #PA17, not the multinationals gouging us"
247,"Sep 7, 2022","Hey 
@JeremyShafferPA
, stop undercutting American workers with your foreign-made crap tee shirts. 

Sincerely, the union-endorsed candidate with shirts made by AMERICAN UNION WORKERS."
248,"Sep 12, 2022",There he goes again...
