,date,text
0,"Nov 8, 2022",I am honored and grateful that the people of #PA17 have elected me as their next Congressman to serve Western Pennsylvania in Congress. Read my full statement here:
1,"Nov 8, 2022","Polls are now open, #PA17! I’m out here at the polls in Aliquippa greeting folks and making sure they vote blue today!"
2,"Nov 8, 2022","The sun might have went down, but we are still out at the polls here in #PA17! Go vote! 🗳"
3,"Nov 8, 2022","I ended the day at the polls at the place where it all began for me, in Thornburg where I grew up, where I learned the values I’ll take to Washington. #PA17"
4,"Nov 8, 2022","Western PA made me the man I am today. From stepping up to serve this country in uniform, to fighting for our common good across #PA17, those values always guide me. And when I'm your Congressman, I will always put you, your families, and this country first."
5,"Nov 8, 2022","I just joined my family to proudly vote for our common good, our freedom, and our shared prosperity here in #PA17. Together, I know that we can keep fighting to make America the land of hope and dreams for all of us. Let’s go!"
6,"Nov 8, 2022",Great to stop by the Eastridge Library in Wilkinsburg to see some current—and future #PA17 voters—as well!
7,,"Proud to join @JohnFetterman and @giselefetterman to rally a massive crowd to get out the vote tomorrow. We're ready to win here in #PA17 and across the Commonwealth, and John and I are ready to serve. Big thanks to @EASCarpenters for hosting us tonight!"
8,"Nov 7, 2022",Corporate executive Jeremy Shaffer really can't stand to be asked about his business in China (or Saudi Arabia!). Corporations like the one that made him rich are raking in millions building up China's infrastructure & selling out folks from #PA17. Need proof? Here:
9,"Nov 7, 2022","On the eve of Election Day, I proudly joined our next Lieutenant Governor of Pennsylvania 
@AustinDavisPA
 at our #TeamDeluzio campaign headquarters to phone bank! Less than 24 hours, #PA17! Let's do this!"
10,"Nov 7, 2022","Tomorrow, freedom is on the ballot in #PA17. I'm in this race to protect our rights to vote, to have a union, to make your own pregnancy and health care decisions, and so much more. 🇺🇸"
11,"Nov 7, 2022","🚨🚨🚨 Beaver County has published the list of voters who need to fix their mail-in ballots. If you voted by mail in Beaver County, please check this list! #PA17"
12,"Nov 7, 2022","We have to rein in the corporate predators sitting on soaring profits and ripping us all off here in #PA17. When I'm your Congressman, I'll be fighting these giants in Washington. Let's win this!"
13,"Nov 7, 2022","My opponent 🤝 Hurting #PA17 seniors

If elected, Shaffer will join other radical Republicans to put Social Security on the chopping block and undermine seniors' health care by cutting Medicare. 

I won't let that stand. Our seniors deserve better."
14,"Nov 6, 2022","It's despicable that Jeremy Shaffer would stand with Pat Toomey over veterans in #PA17, a guy who tried to block benefits for veterans like me exposed to burn pits in war zones. #PA17Debate"
15,"Nov 6, 2022","Great to have 
@francoharrishof
 join #TeamDeluzio for a canvass launch in Shaler this afternoon.

Only a few days left until Election Day—let's do this, #PA17!"
16,"Nov 6, 2022","It doesn't matter if you teach, serve coffee, or make steel. You have the right to a strong union. And I'll stand with you, always. ✊ #PA17"
17,"Nov 6, 2022",Proud to address everyone at Ebenezer AME Church and Greater Miracle Ministries today. I'm ready to serve for the good people in these congregations and all across #PA17!
18,"Nov 6, 2022","I proudly served in uniform with 
@BarackObama
 as my Commander-in-Chief. And I am extremely proud to have his backing in our race to serve the people of #PA17!"
19,"Nov 5, 2022",It was great to join the San Rocco Foundation for their annual Night at the Races event. The crowd at St. Francis Cabrini Church in Center Twp. was packed! Viva San Rocco! #PA17
20,"Nov 5, 2022","Folks in #PA17 may be changing their clocks back an hour tonight, but that doesn't mean we have to move this district back 50 years by letting my extremist opponent ban abortion nationwide.

This election will determine our future. Go vote!"
21,"Nov 5, 2022","🗳️Election Day is just days away, #PA17🗳️. So make a plan to vote, vote for Democrats up and down the ballot, and tell everyone you know to do the same! 

Get more info ▶️"
22,"Nov 5, 2022","I also caught up with legend and friend 
@francoharrishof
 at today's rally. Proud to count Franco on #TeamDeluzio! #PA17"
23,"Nov 5, 2022","I was honored to join 
@BarackObama
, 
@JohnFetterman
, 
@LindseyForPA
 and many others to rally today. Folks are fired up and ready to vote for Democrats who will deliver results for the hard-working men and women here in Western PA! #PA17"
24,"Nov 5, 2022","Great to rally with the Char Valley Democrats last night. Folks are fired up to defend the union way of life, to take on price-gouging corporations, and to stand up for our freedom in #PA17!"
25,"Nov 4, 2022","Shaffer didn't have the spine to be honest with voters about his support for Oz in the #PA17Debate, yet is standing on a stage with him today.

I don't know what Jeremy learned where he's from, but growing up in #PA17 you and I learned about honesty and courage."
26,"Nov 4, 2022",Nothing better than a quick taco break at La Poblanita in Coraopolis—one of my favorites in #PA17!
27,"Nov 4, 2022","Seniors in #PA17 deserve a Congressman who will fight for them and their hard-earned benefits. 

I will always protect Social Security and Medicare and take on Big Pharma to lower prescription drug costs—because that's what it means to put Pennsylvanians first."
28,"Nov 4, 2022",We don't need right-wing politicians like Shaffer & Mastriano having anything to say about your reproductive & health care decisions. These extremists want to attack abortion rights if they get power & will lie through their teeth to get there. Let's beat em! #PA17Debate #PA17
29,"Nov 4, 2022","We have to fight the corporate jagoffs ripping us off, sitting on record profits that we're all paying for. They already have enough yes-men working for 'em in Congress; they don't need another one like my #PA17 corporate executive opponent."
30,"Nov 3, 2022","I risked my life for this country because I believe in America. The patriotism I learned growing up right here in #PA17 demands we fight for our common good. And I'm running for Congress to serve this country and all of us once again, always putting you and your families first.🇺🇸"
31,"Nov 3, 2022",Jeremy Shaffer and these extremists who tried to overthrow our government are a threat to our freedom. I won't give them an inch. #PA17 #PA17Debate
32,"Nov 3, 2022","Honored to have the endorsement of the Pittsburgh Regional Building Trades Council. They support Republicans and Democrats but are proudly standing behind me in #PA17. 

I will always fight for the backbone of Western PA—our workers, jobs, and unions."
33,"Nov 2, 2022",Don’t miss your chance to watch my big win in our only #PA17Debate!
34,"Nov 2, 2022",Just disgraceful stuff from corporate executive Shaffer and his pals coddling our economic adversary and selling us out. #PA17
35,"Nov 2, 2022","When I'm your #PA17 Congressman, I'll be fighting to: 
☑️bring back our manufacturing jobs & supply chains 

☑️end the lousy trade deals 

☑️fight corporate price gouging"
36,"Nov 2, 2022","It was a great afternoon to knock some doors in Harmar. Spoke to a bunch of folks, lots of worry that the GOP is coming for Social Security. I won't let that happen. #PA17"
37,"Nov 2, 2022",These insane Republican threats to Social Security and Medicare would send millions of retirees into poverty. I'll fight them tooth and nail when I'm your #PA17 Congressman.
38,"Nov 1, 2022","I think you should have the right to make your own decisions about your pregnancy  and health care, and I'll vote in Congress to protect abortion rights. [1/2]"
39,"Nov 1, 2022","Unlike the anti-abortion extremist I'm running against, you won't see me running dishonest ads about my record, lying to #PA17 voters. [2/2]"
40,"Nov 1, 2022","I joined 
@JoshShapiroPA
 and 
@AustinDavisPA
 at their Beaver County bus tour stop this afternoon. Our folks in Beaver County are fired up and ready to win! #PA17"
41,"Nov 1, 2022","Coming out of our big win in last week's #PA17 debate, #TeamDeluzio is really feeling the momentum—even Fox News has seen the shift in moving the race rating toward us to win! https://foxnews.com/politics/fox-news-power-rankings-republicans-expected-control-house-both-parties-hold-pathways-senate"
42,"Nov 1, 2022","The future I'm fighting for in western PA is a bright one: more solid jobs, strong unions, a healthy democracy, and the freedom to plan your families and health care. My kids and yours deserve that future—let's make it happen #PA17!"
43,"Oct 31, 2022",It was a great Halloween night in Aspinwall trick or treating with my three favorite Dalmatians and Cruella de Vil! Happy Halloween to everyone across #PA17!
44,"Oct 31, 2022","While I’m disappointed the voters of #PA17 will not get another chance to see and hear the clear contrast between me and Jeremy Shaffer on a debate stage, I wish him a speedy recovery."
45,"Oct 31, 2022","From unions representing cops to firefighters to prosecutors, I'm proud to have support in #PA17 from those who keep us safe and to be the union-backed candidate in #PA17. 

As a guy who was willing to risk my life for this country, you know I'll always fight to keep us safe."
46,"Oct 31, 2022",Happy Halloween to everyone who didn’t try to overthrow the government!
47,"Oct 30, 2022","Happy Halloween weekend! Our grassroots network is everywhere in #PA17, ready to win!"
48,"Oct 30, 2022","Grateful to 
@MadeleineDean
 for coming out to campaign with me in #PA17, but I had to remind her that she's in Steelers Country! #HereWeGo"
49,"Oct 30, 2022",Knocking doors with the oldest — start ‘em young! #PA17
50,"Oct 30, 2022","Corporate Republicans like my opponent are always going to give huge corporations and guys like 
@JeffBezos
 everything they want. 

In Congress, I'll fight to rein in Big Tech and price gouging monopolies."
51,"Oct 29, 2022",Did you miss the #PA17Debate last night? You can watch it tonight at 9pm on KDKA:
52,"Oct 29, 2022","Thrilled to have 
@ConorLambPA
, 
@MadeleineDean
 and 
@VoteDanMiller
 join me to kick off our Mt. Lebanon canvass launch this afternoon. Come out and join us in the next 10 days! #PA17 https://mobilize.us/chrisforpa/"
53,"Oct 28, 2022","Corporate jagoffs don’t need another champion in Congress, you do."
54,"Oct 29, 2022",Took the whole family up to the Oakmont Fall Festival to meet more #PA17 voters and hear the issues on their minds. You know what’s scarier than Halloween? Another corporate executive in Congress 👻
55,"Oct 29, 2022",My kids also got in on the Halloween fun!
56,"Oct 29, 2022","What an honor to have 
@ClyburnSC06
 in Wilkinsburg this morning to launch a huge canvass from Nancy’s Revival. Folks are fired up for the last 10 days! #PA17"
57,"Oct 28, 2022","I know first-hand what it’s like to serve in uniform, to be willing to risk my life for us, and I’ll always put you, your families, and this country first when I’m your Congressman. #PA17Debate"
58,"Oct 28, 2022",The Supreme Court has undone decades of precedent in Roe to attack reproductive freedom. They’ve been attacking workers’ rights for years and made unlimited corporate money free speech. People have lost confidence and feel powerless. We need reform! #PA17Debate
59,"Oct 28, 2022","Jeremy Shaffer is campaigning with election deniers - people who will do everything to undermine our elections, our democracy, and the integrity of YOUR VOTE. #PA17Debate"
60,"Oct 28, 2022",I have young daughters. I don’t want Doug Mastriano & Jeremy Shaffer to ever have a say in their reproductive or healthcare decisions. They are extremists who support national abortion bans & are threatening to put women and doctors in prison.
61,"Oct 28, 2022",I will do everything I can to protect women’s freedom! #PA17Debate
62,"Oct 28, 2022","Jeremy, why do you refuse to denounce the insurrection? Why won’t you denounce the assault on our democracy??? Time and time again you’ve had the opportunity and you have refused. People who won’t denounce it are a threat to America. #PA17Debate"
63,"Oct 28, 2022",Corporations need to stop ripping us off. Too many corps don’t pay a dime in income tax & ship our jobs overseas.
64,"Oct 28, 2022",Republicans like Jeremy Shaffer are ok with that and have signed pledges to never raise taxes on these companies. This hurts western PA families and does nothing to bring costs down and bring jobs home. #PA17Debate
65,"Oct 28, 2022","The weapons of war that my friends and I carried in Iraq should not be allowed in our schools, our churches, or in our streets! Period. #PA17Debate"
66,"Oct 28, 2022","I’m a parent of young children. Like every other parent, I want them to be safe. I will do everything I can when I’m in Washington to make sure local police departments and prosecutors have the resources they need to keep our children safe wherever they go. #PA17Debate"
67,"Oct 28, 2022","Let me be clear - I totally support funding for local police departments! I know what it’s like to wear a uniform and carry a gun to keep us safe and am proud to be backed by unions for cops, firefighters, and prosecutors. #PA17Debate"
68,"Oct 28, 2022",I’m not giving China a chance to undercut our workers and take our factories! I will do everything I can to bring our jobs back home to western PA where they belong! #PA17Debate
69,"Oct 28, 2022",Jeremy Shaffer has made a fortune building roads and bridges (even nuclear power) in Communist China. We need to get tough on China and invest in jobs and infrastructure right here in America! #PA17Debate
70,"Oct 28, 2022",Jeremy Shaffer - western PA is still waiting for an answer to this question. Do you or don’t you support Dr. Oz for Senate and Doug Mastriano for Governor? #PA17Debate
71,"Oct 28, 2022",Tune in to the first #PA17Debate TONIGHT! Here is how to watch:
72,"Oct 28, 2022","Today is National First Responders Day and I want to thank our brave neighbors who step up to keep us safe. From our police officers and firefighters to EMTs and paramedics, and every other first responder who answers the call to serve and protect others, thank you! 🇺🇸"
73,"Oct 28, 2022","Honored to have the endorsement of the PA Professional Firefighters Association. As a guy who led firefighters as an officer in the Navy, and on National First Responders Day, this one means a lot. #PA17"
74,"Oct 28, 2022","ICYMI: ""Chris Deluzio has walked the walk"""
75,"Oct 27, 2022","Shaffer campaigns with insurrectionists, takes money from insurrectionists, and has 20+ members of Congress who voted to throw out our votes in 2020 bankrolling his 4th run for office. #PA17"
76,"Oct 27, 2022","Huge corporations with too much power have been jacking up prices while making record $$. CEOs are openly bragging about it! 
I'll fight them. No more price gouging, no more lousy trade deals & stretched supply chains, no more crushing workers & consumers."
77,"Oct 27, 2022","Four years ago, we experienced great tragedy driven by bigotry and hatred. We must continue to fight antisemitism everyday. 

Today, we honor and remember the victims of the Tree of Life. This town is #StrongerThanHate."
78,"Oct 27, 2022","We beat the sunrise to talk with workers at the Beaver Valley Power Station alongside 
@IBEW
 and 
@GoIUPAT
. 

And fueling up after at Beaver’s Cafe Kolache was a great start to the day!"
79,"Oct 26, 2022","I joined 
@chucktodd
 earlier today to talk about the issues facing folks here in Western PA and the things I will fight for in Congress. #PA17"
80,"Oct 25, 2022","Political leaders shouldn’t make decisions about anyone’s pregnancy.

Women should. Period."
81,"Oct 25, 2022","It is disqualifying for my opponent to continue to seek endorsements from, campaign with, and be bankrolled and supported by insurrectionists, the very folks who voted to throw out our votes and who stormed the Capitol to violently overthrow our democracy."
82,"Oct 25, 2022","I've pledged to join the For Country Caucus, a group of veterans from both parties in Congress, who are committed to working in a bipartisan fashion. We know what it means to put this country first, above party, & I'll always work across the aisle to deliver for western PA. #PA17"
83,"Oct 24, 2022","Proud to stand on the picket line with 
@AlleghenyLabor
, 
@Bob_Casey
 and the 
@PittsburghPG
 workers from 
@CWAUnion
, 
@Teamsters
, and 
@PGHGuild
. I'll always have workers' backs in #PA17."
84,"Oct 24, 2022","While these workers are on strike, I will continue to refuse to speak with The Post-Gazette. I will, however, speak with The Pittsburgh Union Progress (
@ThePUPNews
) and suggest folks check out their work at"
85,"Oct 24, 2022","No help from the Koch brothers & other corporate giants. No $1,000,000 self-funding from a corporate fortune. #TeamDeluzio is powered by working people. Every $ you can manage helps us reach #PA17 voters in these last critical weeks of the race. Thank you!"
86,"Oct 24, 2022",Today is the LAST DAY to register to vote. Head over to http://Vote.PA.gov to register + check your registration status to make sure you are ready to protect democracy in #PA17!   http://vote.pa.gov/Register-to-Vote
87,"Oct 24, 2022","I pledged an oath to defend our democracy. 

My opponent has bent the knee to the man who is attacking it. 

That’s the difference in this campaign. #PA17"
88,"Oct 24, 2022",Happy Diwali!
89,"Oct 23, 2022","I love how #PA17 communities honor my fellow veterans with banners—just like Neville Island, where I was knocking doors today. (But watch out for that huge skeleton!) [1/2]"
90,"Oct 23, 2022","When you grow up around here, you learn the values of service & sacrifice that have shaped western PA for generations, where folks have always stepped up for this country 🇺🇸 [2/2]"
91,"Oct 23, 2022","Corporate execs have been stiffing folks, crushing unions, & outsourcing jobs to China & all over the planet for way too long. [1/2]"
92,"Oct 23, 2022","When you send me to Congress, I'll be fighting to make em pay their damn taxes, to bring back our factories, and to give #PA17 workers a fair shot. [2/2]"
93,"Oct 23, 2022","People all across western PA are tired of getting ripped off. Meanwhile, corporate profits are hitting 70-year highs. 

I'm in this #PA17 race because folks have been gouged by greedy corporate profiteers and lousy trade deals long enough. 

It's time to fight back."
94,"Oct 22, 2022","Xi Jinping is a despot leading China's economic attack on America. Yet Jeremy Shaffer's business has been helping them build infrastructure. We've got to be fighting Beijing to bring back jobs to #PA17, not selling out western PA like Shaffer & his pals."
95,"Oct 22, 2022","Holy smokes, what a day. Thank you to all of the #TeamDeluzio volunteers who are making Knocktober a huge success. This is the energy we need to sprint through the finish on Nov. 8th! 

Can you join us to knock on some doors in your neighborhood? https://mobilize.us/chrisforpa/"
96,"Oct 22, 2022","So much is on the line this election: our right to vote, to plan our families, and to work and retire with dignity & security. This is a fight for freedom and for an economy that rewards work, not just wealth. Let's bring home a win for western PA families in #PA17."
97,"Oct 22, 2022","Mastriano and Shaffer will mean more chaos, more conspiracy theories, more attacks on our government and our freedom. We won’t let their extremism win in #PA17."
98,"Oct 21, 2022",#TeamDeluzio has had meet and greets all across #PA17 (just like tonight in Green Tree). Thanks to all the folks who have opened up their homes to host and rally voters for our common good!
99,"Oct 21, 2022","🇺🇸 Stop relying on far-flung supply chains  
🇺🇸 Make stuff right here again 
🇺🇸 Take on price gouging corporations 
🇺🇸 Vote for our common good in #PA17"
100,"Oct 21, 2022","Medicare, Medicaid, VA health care—all in danger if Jeremy Shaffer ever gets a vote in Congress. Let's keep that corporate executive out of Congress and his hands off your health care. #PA17"
101,"Oct 21, 2022","Proud to stand with #PA17 unions and workers, who know I'll always have their back. We don't need another corporate shill in Congress, we need someone from Western PA who will always fight for workers and the jobs to make stuff right here at home."
102,"Oct 21, 2022",Thanks to the Port of Pittsburgh Commission leadership for a great briefing on the importance of keeping commerce moving on our rivers. I’ll be working hard in Congress for the funding we need for our locks and dams and infrastructure across the board. Let’s get to work! #PA17
103,"Oct 20, 2022","I had a great lunch today at Central Diner in Robinson with Steelers legend (and #PA17 voter!) 
@francoharrishof
. If anyone knows how to win a tough fight, it's this guy. Proud to have him on #TeamDeluzio!"
104,"Oct 20, 2022","This is the group that's plowing money into #PA17 for Shaffer—the same group that wants to ban abortion, even for brutal cases of rape and incest. My opponent is lying through his teeth on TV to cover up his anti-abortion record. Just cynical and pathetic. https://prolifealliance.com"
105,"Oct 20, 2022",Check it out:
106,"Oct 20, 2022","Like most in #PA17, I believe in upholding the Constitution and protecting free and fair elections. 

My opponent campaigns alongside extremists and traitors like Doug Mastriano and Kevin McCarthy, people who tried to overthrow our democracy in 2020."
107,"Oct 19, 2022","Great to tour ATI Brackenridge and spend time with the 
@steelworkers
 members whose hard work makes the place run. We have the workers and businesses that know how to make stuff right here in western PA, and I'll always fight for our union manufacturing jobs in #PA17."
108,"Oct 19, 2022","Want to know why your burger has gotten so expensive? Four giant meatpacking companies control 85% of the market, and they're setting prices, ripping us off, and making fat profits. [1/2]"
109,"Oct 19, 2022","When I'm in Congress, I'll be fighting these corporate giants so to stop them from gouging folks, killing small businesses, and hurting workers. #PA17 [2/2]"
110,"Oct 19, 2022","Honored to have the endorsement of 
@Steamfitters449
, like the 
@Boilermakers154
, 
@WpaLaborers
, & others, they support both Rs & Ds but are proudly backing me in #PA17. 

They know that party matters less than standing up for workers, jobs, and the union way of life. Thank you!"
111,"Oct 19, 2022","Huge corporate super PACs are attacking us because they're scared of losing power, they're afraid of a veteran like me who will always put western PA and our common good first. 

If you can manage, please support our fight and let's win in November!"
112,"Oct 19, 2022","Jeremy Shaffer’s cynical dishonesty about his anti-abortion extremism is plain for all to see. 

I am the only candidate in #PA17 who will protect abortion rights and women’s freedom to make their own decisions."
113,"Oct 19, 2022","Journalists call out Shaffer for lying to voters about his anti-abortion views…

Shaffer: “No comment”"
114,"Oct 18, 2022",Voters were willing to brave the cold tonight in the Quaker Valley! Thanks for coming out to learn about this campaign and our fight for the common good in #PA17.
115,"Oct 18, 2022","Shaffer KNOWS his extremist views on choice are hurting him. Now he's lying to save his sinking campaign. The Pro-Life Alliance is 100% behind him, even sending mail to help, bc they know he'll always vote for Life at Conception bills (outlawing abortion, with no exceptions.)"
116,"Oct 18, 2022","Shaffer and his radical allies will stop at nothing to take away your reproductive freedom, and we have to fight back. Can you chip in today help us combat his disinformation campaign?"
117,"Oct 18, 2022","I stand with the 
@PGHGuild
 and Post-Gazette workers on strike. They deserve a heck of a lot better from a newspaper that their work has made one of the best in the country!"
118,"Oct 18, 2022","Growing up right here in western PA, I learned the values we all know: hard work, service, love of country. 

Those values shaped who I am, they drove me to answer the call to wear the uniform after 9/11, and they will always guide me as your #PA17 Congressman."
119,"Oct 18, 2022","Proud to have outraised my corporate executive opponent 2:1. 

Despite Shaffer plowing a million bucks of his personal fortune into this race, he can't keep up with our grassroots power. 

#TeamDeluzio is sprinting to the finish! #PA17"
120,"Oct 17, 2022",It's been inspiring to see so many folks across #PA17 standing up to fight the radical anti-women and anti-family agenda of Jeremy Shaffer & Doug Mastriano. Let's win this!
121,"Oct 17, 2022","Corporate greed is hurting working families, plain and simple. And I'm gonna fight it in Washington. #PA17"
122,"Oct 17, 2022","I had a great time speaking with RMU students, who are fired up and ready to fight for their future right here in #PA17!"
123,"Oct 16, 2022",A Steelers win + great meet & greet with voters in Glen Osborne make a pretty darn good end to a pretty darn good weekend in #PA17 for #TeamDeluzio.
124,"Oct 16, 2022","From rallying with voters in Verona to meeting with members of the 
@TCCPittsburgh
 to launching another canvas, #TeamDeluzio is crisscrossing #PA17 to get out the vote!"
