,date,text
249,"Sep 16, 2022","💪
@AlleghenyLabor

This is what a union strong shirt made right here at home looks like, and my team will always have our campaign gear made by American union workers. (But if you want foreign-made campaign crap, go check out the guy I'm running against.)"
250,"Sep 15, 2022","Here’s a pretty simple idea: let’s ban members of Congress from trading stock. Put the common good first, for crying out loud."
251,"Sep 15, 2022",#TeamDeluzio isn't funded by corporate PACS or $1 million in self-funding like the other guy. We run on the power of the people. Will you join our fight for the common good?
252,"Sep 14, 2022","Corporate executive Jeremy Shaffer is rubbing elbows in DC tonight at a corporate lobbying event. This guy is letting us all know who he answers to, and it ain’t #PA17 working families."
253,"Sep 14, 2022","This is the kind of pro-kids, pro-education, pro-family policy I'll fight for in Congress."
254,"Sep 14, 2022","Jeremy Shaffer just opened a joint campaign office with Doug Mastriano. They worked together in the primary. These extremists are a threat to the Constitution and our freedom. And the people of #PA17—Democrats, Republicans, and Independents alike—are rejecting their crazy agenda."
255,"Sep 14, 2022",Here are the receipts:
256,"Sep 14, 2022","Greedy corporations will keep trying to bust unions if we don't rein them in. I will always fight for the right to organize, the union way of life, and real penalties for illegal union busters. 
@pghsbuxunited"
257,"Sep 13, 2022","If you want a nationwide abortion ban, vote for the other guy. His backers and pals in Congress are trying to ban abortion and can't wait to pass this bill if they take power."
258,"Sep 13, 2022","The difference is clear. I'm proud to be endorsed by 
@PPact
 + 
@NationalNOWPAC
 and will always defend the right to a safe, legal abortion."
259,"Sep 13, 2022","We don't need more corporate shills, like my opponent who's made millions at a huge corporation building infrastructure in China, who's run for office 4x funded by those millions. [1/2]"
260,"Sep 13, 2022","I'm in this race because I believe in America, as someone who's worn the uniform, who will always put the people of western PA ahead of price-gouging corporations & crooked politicians. [2/2]"
261,"Sep 13, 2022","I was willing to risk my life for our rights, so you know I'll fight to protect reproductive freedom. 

My opponent? He'll try to put an abortion ban in the Constitution and wants to force rape and incest victims (even kids) to give birth."
262,"Sep 12, 2022",Some great investments in #PA17 parks and public lands in Crafton and Reserve!
263,"Sep 12, 2022","Shocker: more 
@JeremyShafferPA
 crappy campaign merch made in China. This guy doesn't give a damn about American workers."
264,"Sep 11, 2022","I hope that as we look back on the last twenty-one years since the 9-11 attacks, we honor the memories of the Americans we lost. That we do justice to their sacrifice by rededicating ourselves to this country and all her promise. 

America is worth fighting for."
265,"Sep 10, 2022",#TeamDeluzio was feeling the love at the inaugural Braddock Hills Community Day. Folks are fired up for November! #PA17
266,"Sep 10, 2022","I joined hardworking folks from 
@MomsDemand
 in Mt. Lebanon for a canvass kickoff. I'm proud to have their support in our race for #PA17. Thank you!"
267,"Sep 10, 2022",Had an awesome time at the Sewickley Harvest Festival this morning. Great to see some old friends and meet some new ones! #PA17
268,"Sep 10, 2022","#TeamDeluzio joined forces with 
@VenkatforPA
 to talk to voters in the North Hills this morning. We have canvasses launching all over #PA17, join us: https://mobilize.us/chrisforpa/"
269,"Sep 9, 2022","It was great to talk jobs, manufacturing, workforce development, and so much more today with 
@TheBCCC
. Let’s get to work! #PA17"
270,"Sep 9, 2022","Thanks to the Infrastructure Bill, western PA will recieve big $$$ to expand broadband internet. And Beaver County has put in the work to identify where broadband access is lacking. #PA17 https://post-gazette.com/news/state/2022/09/08/pennsylvania-broadband-map-federal-funding-internet-speeds-fcc-maps/stories/202209080072"
271,"Sep 8, 2022","It was great to spend some time with 
@NALC_National
 today. The Postal Service is a critical public service with hard-working folks delivering for the American people. Thank you!"
272,"Sep 8, 2022",Western PA is ready to lead the fight for our energy security—today and tomorrow—with strong union jobs in #PA17.
273,"Sep 7, 2022","Here in Western PA, you step up for your community when it’s in crisis. It’s why I joined the Navy after 9/11 and served in Iraq. It’s why I led election security efforts at Pitt. And it’s why I’m stepping up again now - to fight for our Western PA values. #PA17"
274,"Sep 6, 2022","A well-deserved and overdue honor for Steelers legend and #PA17 resident 
@francoharrishof
! #HereWeGo  #SteelersNation"
275,"Sep 6, 2022","Honored to be endorsed by 
@SSWorks
, and have the support of Jon “Bowzer” Bauman.

I’ll always fight to protect Social Security and Medicare from right wing attacks on seniors."
276,"Sep 6, 2022","From price gouging to bad trade deals that killed local jobs, the working people of western PA have been getting a raw deal for too long. I will fight to bring down prices and make stuff right here in #PA17, always standing for the union way of life."
277,"Sep 5, 2022","What a morning marching with union sisters and brothers in the Labor Day Parade. I am so honored to be Labor’s candidate in #PA17, and I’ll keep fighting every single day for the union way of life in western PA. Solidarity Forever!"
278,"Sep 5, 2022",Hope to see you at the Labor Day parade this morning! #1u
279,"Sep 5, 2022","Unions lift up all workers, pass it on."
280,"Sep 4, 2022","It was a busy afternoon in the North Hills. I stopped by the Taste of Greece Festival at 
@HolyTrinityPgh
 for a top-notch gyro and to check out the markets. Then I hit the doors (and hills) in Ross! #PA17"
281,"Sep 4, 2022","If you want stuck with the bill for billionaire/corp tax cuts & an abortion ban, check out my right-wing opponent. If you want to fight the greedy corporations gouging us & to bring back our supply chains and jobs, I'm your #PA17 candidate."
282,"Sep 4, 2022","Loving that union-made coffee - and proud to stand in solidarity with the 7707 McKnight Rd 
@pghsbuxunited
 workers. #NoContractNoCoffee #PA17"
283,"Sep 4, 2022","In western PA, we believe in putting people above profits and fighting for our freedom.  Will you join our fight for the common good?

https://mobilize.us/chrisforpa/"
284,"Sep 3, 2022","It was an honor to help out with the 
@AlleghenyLabor
 
@unionveterans
 clean-up today. Labor’s Weekend of Service is all about serving others all over our region, and I’m proud to support it. #1u"
285,"Sep 3, 2022",Great coffee and conversations at the veterans breakfast this morning at Uncommon Grounds in Aliquippa. #PA17
286,"Sep 3, 2022","The western PA labor movement welcomes everyone. This is not just about one factory or one coffee chain, it's a fight for freedom, dignity, and the common good. I'm proud to stand with so many demanding the fair shake that every worker has earned."
287,"Sep 2, 2022",Workers' rights are on the ballot in this election. And #TeamDeluzio is the proud pro-labor and pro-worker campaign in this race. #PA17
288,"Sep 2, 2022",Apollo from Moon is ready to be a #DogsForDeluzio celebrity!
289,"Sep 2, 2022","Happy to help 
@AlleghenyLabor
 kick off the Labor Day weekend of service by donating blood. You can stop by to donate and help folks in our community at PPG Paints Arena until 5pm! #1u 
@penguins


https://vitalant.org/weekendofservice"
290,"Sep 2, 2022","Jobs! Jobs! Jobs!

Our region is getting huge investments in our AI & robotics sector thanks to the American Rescue Plan (ya know, the bill that every single Republican voted against)"
291,"Sep 2, 2022",Huge win for the Panthers...and what a night for Quip MJ Devonshire! #H2P
292,"Sep 1, 2022",What a great and fired up crowd for tonight's AK Valley meet & greet at Harmar House. Folks all across #PA17 are ready to put in the work to win this thing!
293,"Sep 1, 2022","We need a member of Congress in #PA17 with foreign policy experience to stand up to Beijing. 

I'm the only candidate in this race who's led Americans abroad in uniform, who's seen the threat from China, and who has the experience to do the job in DC."
294,"Sep 1, 2022",FIRED UP for the Backyard Brawl tonight and a big Pitt win...Hail to Pitt!
295,"Sep 1, 2022","No need to catch my opponent on a hot mic, his extremist views are out there for all to see. He supports putting an abortion ban in the Constitution, and even opposes exceptions for victims of rape and incest. Way too extreme for western PA."
296,"Aug 31, 2022","Here's a taste of what I'm about:

making more stuff right here in western PA 🇺🇸; 

fighting the greedy corporations gouging us; 

protecting unions and small businesses; 

getting massive corporations to pay their fair share of taxes"
297,"Aug 31, 2022","I learned a simple lesson in uniform, in the fight for a union at Pitt, and growing up here in western PA:  solidarity. You never leave a person behind. And it's central to this fight for our freedom and our common good. #PA17"
298,"Aug 31, 2022","My right-wing opponent made millions as an exec at a massive corporation that builds infrastructure for China. He's already spent $1 million of his own fortune to try and buy this seat.

Can you help #TeamDeluzio in this people-powered campaign?

https://secure.actblue.com/donate/chris-d"
299,"Aug 31, 2022",It was a perfect morning for a tour of the awesome trails and beehives at Kane Woods Nature Area in Scott Township. What a gem—and Yankee Doodle loved it! #PA17
300,"Aug 30, 2022",Patriotism means fighting to bring back jobs & make more stuff here to lower costs. #TeamDeluzio is proud to be the pro-worker & pro-family campaign in #PA17. But I'm sure the greedy corporations gouging us and shipping our jobs overseas love the corporate exec we're up against.
301,"Aug 30, 2022","Thanks @RosedaleTech
 for showing me your campus, and all you’re doing to build up our western PA workforce."
302,"Aug 30, 2022","More good news for #PA17 in the American Rescue Plan: big investments in broadband internet in Beaver County. We should have world-class infrastructure all across #PA17, and we can build it with good union jobs."
303,"Aug 29, 2022",My condolences to the many folks who loved Jack Shea and all he did for working people. The western PA labor movement has lost a giant.
304,"Aug 29, 2022",Let's win this!✊
305,"Aug 29, 2022",Corporate greed is squeezing the hardworking families of #PA17. I will stand up for western PA and fight the huge corporations gouging us. My right-wing opponent would give them a tax cut.
306,"Aug 29, 2022","Like most folks in western PA, I believe it's a representative's job to protect and expand the rights of this community. My extremist opponent wants to ban abortion, even for victims of rape and incest. The radical right is too dangerous for #PA17."
307,"Aug 28, 2022","From the Hookstown Fair to a big rally in Indiana Township, it’s great to see #TeamDeluzio working in every corner of #PA17 this weekend. Let’s win this!"
308,"Aug 27, 2022","Huge thanks to all the #TeamDeluzio volunteers who joined me before knocking doors in Ross, Shaler, and Mt. Lebanon today! (And thanks to so many others knocking all over #PA17 today for our common good!) @LindseyForPA"
309,"Aug 26, 2022",What an honor to address the Rally for Our Rights in Millvale. We’re up against an extremist movement that wants to tear down all of our personal freedoms. I will fight to restore and protect reproductive rights in western PA. #PA17
310,"Aug 26, 2022",Happy National Dog Day to Yankee Doodle and all the #DogsForDeluzio!
311,"Aug 26, 2022","Today is #WomensEqualityDay, but as we celebrate 102 years since the ratification of the 19th amendment, we must also acknowledge that women’s rights are under attack in this country today. The fight for equality and freedoms must never stop."
312,"Aug 26, 2022","With so many #PA17 kids heading back to school lately, here's to hoping you're all as excited as 6-year-old me heading to 1st Grade at Ingram Elementary!"
313,"Aug 25, 2022",What a great end to the day with my family at River Jam in Aspinwall. Can’t beat those river views! #PA17
314,"Aug 25, 2022",It’s been over a week and my opponent still hasn’t accepted this debate… #PA17
315,"Aug 25, 2022","I was lucky enough to grow up right here in #PA17. Those western PA values I learned in this community led me to the Navy, the fight for a union, and this campaign for our common good."
316,"Aug 24, 2022","Western PA is getting major investments like this thanks to the federal infrastructure bill. This means jobs, more business for the region, and a boost to our economy. When I'm in Congress, I'll fight for more investment in western PA - we need it!"
317,"Aug 24, 2022",✊Let's take on the greedy corporations gouging us in western PA.
318,"Aug 24, 2022","My opponent is an extremist who wants an abortion ban in the constitution, even for victims of rape and incest. His views are a threat to our families and our freedom. Help us restore and protect reproductive rights. #PA17 

https://mobilize.us/chrisforpa/"
319,"Aug 23, 2022","I'm fired up after joining @JohnFetterman
, @LindseyForPA
, @VenkatforPA
, and @VoteDanMiller
 at the @steelworkers
 rally this afternoon. I’ll always fight for the union way of life. We're ready to win this! #PA17 ✊"
320,"Aug 23, 2022","And can’t forget our next Lt. Governor @AustinDavisPA
!"
321,"Aug 23, 2022","I was honored to share a stage with @Bob_Casey
 this morning in Midland. He has been a longtime champion for Beaver County and people across western PA, and I’m ready to get to work with him in Washington. Thanks to so many folks and our union brothers and sisters for showing up!"
322,"Aug 23, 2022","#TeamDeluzio is powered by real people. No corporate PACs. No attempts to buy this election like my opponent (he's put in a million $$$ of his fortune).

If you can mange, please support our fight for the common good. #PA17

https://secure.actblue.com/donate/chris-d"
323,"Aug 23, 2022",We're getting millions in healthcare savings and huge investments in western PA manufacturing. This bill is a big win for #PA17.
324,"Aug 22, 2022",There is no place for hate in western PA.
325,"Aug 22, 2022","I'm honored to earn Labor's endorsement. We are the pro-worker campaign in #PA17 (up against an exec at a corporation making millions building infrastructure for China), and we're taking this fight for our common good in western PA all the way to Congress! @PaAFL_CIO
  #Labor2022"
326,"Aug 22, 2022","Jobs! Jobs! Jobs!

Let's make stuff right here in western PA, and let's lead the world in the tech of tomorrow."
327,"Aug 22, 2022","Made by one of our dedicated and talented volunteers in Beaver County. Whether it's baking, sending texts, or knocking doors, our fight for the common good needs your help #PA17. Will you join us?

https://mobilize.us/chrisforpa/"
328,"Aug 21, 2022","Proud to stand with @steelworkers
 Local 1088 workers today to fight for a fair contract. ✊"
329,"Aug 21, 2022","It was a pleasure to address such an enthusiastic and hard-working group. Crudités fans would’ve been disappointed, but there was plenty of ice cream for all. #PA17"
330,"Aug 20, 2022",Knocking doors in Wilkinsburg. #TeamDeluzio is feeling the love! #PA17
331,"Aug 20, 2022",Spent today with some great folks at today’s Penn Hills Community Building event. Don’t miss the backpack giveaway! #PA17
332,"Aug 19, 2022","Hey Western PA, guess what: my opponent is raising money with a right-wing extremist Congressman who voted to throw out our votes in the 2020 presidential election. These people mean chaos and just want power at the expense of our freedom. Hard pass. #PA17"
333,"Aug 19, 2022",Let's roll back the heartless trade deals that stole so much work from our communities and drove up costs for us. It's time to make stuff right here in western PA with solid union jobs and take on the corporate greed that's been gouging us. #PA17
334,"Aug 19, 2022","This is a radical movement dedicated to attacking our freedom. I will always work to protect and expand our rights, not tear them down."
335,"Aug 18, 2022",The choice is clear...
336,"Aug 18, 2022",Some bad news out of Rochester this morning. Wishing a speedy recovery for those who were injured and grateful that there are good people like our first responders always ready to run toward a blaze to keep our communities safe.
337,"Aug 17, 2022",Thanks to all the folks who came out for our #TeamDeluzio office opening party tonight in Coraopolis. Let's win this! @LindseyForPA
338,"Aug 17, 2022","Thanks, @Bob_Casey
 for fighting for investments in PA coal communities in the Inflation Reduction Act."
339,"Aug 17, 2022","Voters deserve to know where we stand on the issues—I'm not afraid to debate and I don’t run away from my positions. How about you @JeremyShafferPA
? @LWVPGH
 @WTAE
 #PA17"
340,"Aug 17, 2022","I'm honored to earn the endorsement of @AFSCME
. I'm fighting for workers across western Pennsylvania, and it means the world to be the labor-backed campaign in #PA17."
341,"Aug 16, 2022","Here’s the world my extremist opponent Jeremy Shaffer wants for western PA. He’s a threat to our freedom, and you better believe I’m not going to stand by and let him and Doug Mastriano take away your right to choose. #PA17"
342,"Aug 16, 2022","Life it too expensive right now. But we know how to bring down costs:  start making stuff here at home again, bring back our supply chains, and take on the corporate power and greed that's gouging all of us. I'll fight to get it done in Congress."
343,"Aug 16, 2022","We already know the facts: Doug Mastriano betrayed the oath he and I both took in uniform. He's a threat to democracy and way too extreme for western PA...and my right-wing opponent is part of the same dangerous, anti-democratic movement."
344,"Aug 16, 2022",The American Rescue Plan Act continues to deliver for #PA17: Beaver Falls is getting $3 million to fund stormwater and blight remediation.
345,"Aug 15, 2022","Running to represent the community that made me who I am is an honor. Join us in our fight for the common good. #PA17

https://mobilize.us/chrisforpa/"
346,"Aug 15, 2022","We're not taking a dime of corporate PAC money in this campaign. That makes support from real folks all the more crucial. If you can manage, please support #TeamDeluzio in our fight for the common good. #PA17

https://secure.actblue.com/donate/chris-deluzio-for-congress-social"
347,"Aug 14, 2022",No better way to end the day than a meeting with supporters in Ross Township. I’m always inspired by the tireless volunteers across #PA17.
348,"Aug 14, 2022","And yes, of course I had to get on the trampoline!"
349,"Aug 14, 2022",I spent the afternoon knocking doors in McCandless - had some great conversations with voters and walked up a lot of hills!
350,"Aug 14, 2022","What a great morning celebrating San Rocco with friends in Aliquippa, from a beautiful mass at St. Titus to the procession through the streets. Viva San Rocco! #PA17"
351,"Aug 14, 2022",Unions lift up all workers and strengthen our democracy. ✊
352,"Aug 13, 2022",It was a great afternoon and evening talking with folks from the North Hills to Forest Hills (with a Millvale visit in between) #PA17
353,"Aug 13, 2022",Thanks to Mayor Dixon for hanging with me at today’s 2nd Saturdays event in Coraopolis. We were feeling the love! #PA17
354,"Aug 12, 2022","My right-wing opponent would glady work with Doug Mastriano to ban abortion, even for rape and incest victims, and crush our labor unions. The radical right is anti-women and anti-worker. Too extreme for #PA17."
355,"Aug 12, 2022",Western PA is ready to bring back our supply chains and manufacturing. We've got the workers and unions and local businesses ready to fight for our jobs and economic future. Let's get to work #PA17!
356,"Aug 11, 2022","Good times hanging out with @Innamo
 and my wonderful neighbors at Aspinwall's Big Night Out this evening. Looking forward to many more! #PA17"
357,"Aug 11, 2022","Freedom is on the ballot, folks. My right wing opponent is on record opposing abortions in cases of rape and incest, forcing even victimized kids to give birth. This kind of extremism is a danger to our rights, and folks in #PA17 want no part of it."
358,"Aug 11, 2022",We have to make stuff right here at home. No more lousy trade deals and no more outsourcing of western PA jobs.
359,"Aug 10, 2022","I will defend Social Security and Medicare from the kind of heartless cuts favored by Ron Johnson, Doug Mastriano, and my right-wing opponent in #PA17."
360,"Aug 10, 2022",It will be an honor to represent this heroic young man in Congress 😂#LetsGoBucs #RTJR #PA17
361,"Aug 10, 2022","Hitting the doors in Coraopolis and checking in with our fantastic Beaver County volunteers getting trained up. #TeamDeluzio is fighting in every corner of #PA17. Will you join us?

https://mobilize.us/chrisforpa/"
362,"Aug 10, 2022","From my time in uniform, to working to protect our elections at Pitt Cyber, to fighting for a union at Pitt alongside @steelworkers
, my life has been about defending our freedom. With your support, we'll take this fight for our common good to Washington."
363,"Aug 9, 2022","A great western Pennsylvanian, who contributed so much to our understanding of our American story. 1776 and Truman are my personal favorites and would recommend if you like reading about history."
364,"Aug 9, 2022","I love to see #PA17 communties working hard for our public parks and recreation programs. Great stuff, Sharpsburg!"
365,"Aug 9, 2022",Affordable Pre-K eases the burden for working families and sets kids up to succeed. This is the kind of pro-family and pro-worker investment I'll fight for in Washington.
366,"Aug 8, 2022","Thanks for being on the team, @RiegerForPA
! 

Please sign up today and join us in our fight for the common good here in #PA17.
https://mobilize.us/chrisforpa/"
367,"Aug 8, 2022","More good news for western PA seniors:  the Inflation Reduction Act caps the costs of insulin (at $35), limits out-of-pocket spending on drugs, and will finally let Medicare negotiate drug prices to bring down costs for folks."
368,"Aug 7, 2022","A huge thanks to all the dedicated folks who braved the heat in Hampton today. Always an honor to share a stage with @SenWilliamsPA
 and @VenkatforPA
. Thanks for having us @Hampton_Dems
. Let's win this!"
369,"Aug 6, 2022","#TeamDeluzio was on the ground all across #PA17 today, talking to folks about our fight for freedom and the common good. Will you join us next time?

https://mobilize.us/chrisforpa/"
370,"Aug 6, 2022",This is what people power looks like.
371,"Aug 6, 2022","If you want an extremist like my opponent who thinks vicitms of rape or incest (even kids) should be forced to give birth, then I am not your candidate. I'll be fighting in Washington to protect our freedom and girls' and women's rights to decide what's best for them."
372,"Aug 5, 2022","We're going to win this race and fight like hell in Congress to stop @JeffBezos
 and his union-busting goons. I'm with you @Teamsters
 ✊"
373,"Aug 5, 2022",Check out this podcast on some of the fascinating civc and cultural work happening in Millvale (like the preservation of the Vanka Murals at St. Nicholas Church) #PA17.
374,"Aug 5, 2022","Great stuff here from @Bob_Casey
 to help #PA17, with millions for projects like upgrading Aliquippa's infrastructure and funding Boys & Girls Club programs in Sto-Rox. Let's get this done!"
375,"Aug 4, 2022","Our radical Supreme Court makes this a critical midterm race for our freedom. Will you join us?

https://mobilize.us/chrisforpa/"
376,"Aug 4, 2022","Great to spend time with Aliquippa Mayor Dwan Walker and Police Chief John Lane at TBJ's Southern Sauce.

(Pro tip: Don't wear a white shirt to a BBQ joint)
@1aliquippa"
377,"Aug 4, 2022",Corporate profits are hitting record highs while everyone else gets screwed. I'm running in #PA17 to take on the price-gouging monopolies preying on working families.
378,"Aug 4, 2022",The right-wing power grabs just keep coming. Extremists in the PA general assembly are trying to jam through constitutional amendments that would restrict abortion rights and more.
379,"Aug 4, 2022","My condolences to the families of Congresswoman Walorski and her staffers, Zachery Potts and Emma Thomson, who lost their lives yesterday."
380,"Aug 3, 2022",Democrats in Marshall Township are fired up to vote in November. Let's win this!
381,"Aug 3, 2022","#TeamDeluzio is powered by the people. No corporate dark money. And I'm up against a Republican who's dumped a million of his own $$$$ to try to buy this seat.

If you can manage, please support our fight for the common good.

https://secure.actblue.com/donate/chris-deluzio-for-congress-social"
382,"Aug 3, 2022",Lots to love and debate in ths listing of the region's best pizza joints. (Where's Millvale's Iron Born?!) What are your #PA17 favorites?
383,"Aug 3, 2022",Jobs jobs jobs! Great stuff here for western PA from @JoshShapiroPA
384,"Aug 3, 2022","Bravo, @linakhanFTC
. American capitalism needs more competition, not Big Tech giants gobbling up competitors and markets."
385,"Aug 3, 2022","There are a lot great policies for #PA17 in The Inflation Reduction Act. It's a bill that would ramp up clean energy and lower the cost of medicine, save people $ and help tackle inflation – all paid for by the ultra-rich and corporations."
