created_at,id,text,context_annotations,geo
2022-10-25 00:57:58+00:00,1584710826329804801,"I’ll be in Longview this Thursday for the for the third #WA03 Debate! Tickets will be available on a first-come-first-serve basis at the venue starting at 5:30. 

Let us know you’re coming: https://t.co/6BhcXPrYww https://t.co/Ktpmwa15td","[{'domain': {'id': '29', 'name': 'Events [Entity Service]', 'description': 'Real world events. '}, 'entity': {'id': '1526278121527205889', 'name': '2022 United States midterm elections'}}, {'domain': {'id': '38', 'name': 'Political Race', 'description': ''}, 'entity': {'id': '1526278121527205889', 'name': '2022 United States midterm elections'}}, {'domain': {'id': '131', 'name': 'Unified Twitter Taxonomy', 'description': 'A taxonomy of user interests. '}, 'entity': {'id': '847878884917886977', 'name': 'Politics', 'description': 'Politics'}}, {'domain': {'id': '131', 'name': 'Unified Twitter Taxonomy', 'description': 'A taxonomy of user interests. '}, 'entity': {'id': '1291447199595782144', 'name': 'United States politics'}}, {'domain': {'id': '131', 'name': 'Unified Twitter Taxonomy', 'description': 'A taxonomy of user interests. '}, 'entity': {'id': '1488973753274929152', 'name': 'Political events'}}, {'domain': {'id': '131', 'name': 'Unified Twitter Taxonomy', 'description': 'A taxonomy of user interests. '}, 'entity': {'id': '1518940645343125504', 'name': 'United States political events'}}, {'domain': {'id': '131', 'name': 'Unified Twitter Taxonomy', 'description': 'A taxonomy of user interests. '}, 'entity': {'id': '1526278121527205889', 'name': '2022 United States midterm elections'}}]",
2022-10-24 20:35:44+00:00,1584644833800753152,"Joe Kent spent his weekend with an out-of-town celebrity.

I spent mine standing with striking woodworkers, enjoying the Longview Harvest Festival, and meeting voters in Vancouver &amp; Ridgefield.

The people of this district are my priority. https://t.co/ZSSYVH5NnT","[{'domain': {'id': '29', 'name': 'Events [Entity Service]', 'description': 'Real world events. '}, 'entity': {'id': '1526278121527205889', 'name': '2022 United States midterm elections'}}, {'domain': {'id': '38', 'name': 'Political Race', 'description': ''}, 'entity': {'id': '1526278121527205889', 'name': '2022 United States midterm elections'}}, {'domain': {'id': '131', 'name': 'Unified Twitter Taxonomy', 'description': 'A taxonomy of user interests. '}, 'entity': {'id': '847878884917886977', 'name': 'Politics', 'description': 'Politics'}}, {'domain': {'id': '131', 'name': 'Unified Twitter Taxonomy', 'description': 'A taxonomy of user interests. '}, 'entity': {'id': '1291447199595782144', 'name': 'United States politics'}}, {'domain': {'id': '131', 'name': 'Unified Twitter Taxonomy', 'description': 'A taxonomy of user interests. '}, 'entity': {'id': '1488973753274929152', 'name': 'Political events'}}, {'domain': {'id': '131', 'name': 'Unified Twitter Taxonomy', 'description': 'A taxonomy of user interests. '}, 'entity': {'id': '1518940645343125504', 'name': 'United States political events'}}, {'domain': {'id': '131', 'name': 'Unified Twitter Taxonomy', 'description': 'A taxonomy of user interests. '}, 'entity': {'id': '1526278121527205889', 'name': '2022 United States midterm elections'}}, {'domain': {'id': '156', 'name': 'Cities', 'description': 'Cities around the world'}, 'entity': {'id': '861946485511823361', 'name': 'Vancouver', 'description': 'Vancouver'}}]",
2022-10-24 18:34:23+00:00,1584614295270137856,"My business definitely exists, not that anyone needed to ask. 
https://t.co/EFCL6VZSq7","[{'domain': {'id': '29', 'name': 'Events [Entity Service]', 'description': 'Real world events. '}, 'entity': {'id': '1526278121527205889', 'name': '2022 United States midterm elections'}}, {'domain': {'id': '38', 'name': 'Political Race', 'description': ''}, 'entity': {'id': '1526278121527205889', 'name': '2022 United States midterm elections'}}, {'domain': {'id': '131', 'name': 'Unified Twitter Taxonomy', 'description': 'A taxonomy of user interests. '}, 'entity': {'id': '847878884917886977', 'name': 'Politics', 'description': 'Politics'}}, {'domain': {'id': '131', 'name': 'Unified Twitter Taxonomy', 'description': 'A taxonomy of user interests. '}, 'entity': {'id': '1291447199595782144', 'name': 'United States politics'}}, {'domain': {'id': '131', 'name': 'Unified Twitter Taxonomy', 'description': 'A taxonomy of user interests. '}, 'entity': {'id': '1488973753274929152', 'name': 'Political events'}}, {'domain': {'id': '131', 'name': 'Unified Twitter Taxonomy', 'description': 'A taxonomy of user interests. '}, 'entity': {'id': '1518940645343125504', 'name': 'United States political events'}}, {'domain': {'id': '131', 'name': 'Unified Twitter Taxonomy', 'description': 'A taxonomy of user interests. '}, 'entity': {'id': '1526278121527205889', 'name': '2022 United States midterm elections'}}]",
2022-10-24 16:44:16+00:00,1584586583763988480,"I don't take corporate PAC money. I rely on grassroots contributors to fund this campaign.

Please chip in now to keep our new TV ad on the air, defeat Joe Kent, and flip #WA03 blue.
https://t.co/iQsEmAa5kB","[{'domain': {'id': '29', 'name': 'Events [Entity Service]', 'description': 'Real world events. '}, 'entity': {'id': '1526278121527205889', 'name': '2022 United States midterm elections'}}, {'domain': {'id': '38', 'name': 'Political Race', 'description': ''}, 'entity': {'id': '1526278121527205889', 'name': '2022 United States midterm elections'}}, {'domain': {'id': '131', 'name': 'Unified Twitter Taxonomy', 'description': 'A taxonomy of user interests. '}, 'entity': {'id': '847878884917886977', 'name': 'Politics', 'description': 'Politics'}}, {'domain': {'id': '131', 'name': 'Unified Twitter Taxonomy', 'description': 'A taxonomy of user interests. '}, 'entity': {'id': '1291447199595782144', 'name': 'United States politics'}}, {'domain': {'id': '131', 'name': 'Unified Twitter Taxonomy', 'description': 'A taxonomy of user interests. '}, 'entity': {'id': '1488973753274929152', 'name': 'Political events'}}, {'domain': {'id': '131', 'name': 'Unified Twitter Taxonomy', 'description': 'A taxonomy of user interests. '}, 'entity': {'id': '1518940645343125504', 'name': 'United States political events'}}, {'domain': {'id': '131', 'name': 'Unified Twitter Taxonomy', 'description': 'A taxonomy of user interests. '}, 'entity': {'id': '1526278121527205889', 'name': '2022 United States midterm elections'}}]",
2022-10-24 16:44:15+00:00,1584586578890231810,"I'm definitely not your typical candidate for Congress. And right now, the only thing standing between Joe Kent and Congress is me. https://t.co/G5j7xgIugQ","[{'domain': {'id': '29', 'name': 'Events [Entity Service]', 'description': 'Real world events. '}, 'entity': {'id': '1526278121527205889', 'name': '2022 United States midterm elections'}}, {'domain': {'id': '38', 'name': 'Political Race', 'description': ''}, 'entity': {'id': '1526278121527205889', 'name': '2022 United States midterm elections'}}, {'domain': {'id': '131', 'name': 'Unified Twitter Taxonomy', 'description': 'A taxonomy of user interests. '}, 'entity': {'id': '847878884917886977', 'name': 'Politics', 'description': 'Politics'}}, {'domain': {'id': '131', 'name': 'Unified Twitter Taxonomy', 'description': 'A taxonomy of user interests. '}, 'entity': {'id': '1291447199595782144', 'name': 'United States politics'}}, {'domain': {'id': '131', 'name': 'Unified Twitter Taxonomy', 'description': 'A taxonomy of user interests. '}, 'entity': {'id': '1488973753274929152', 'name': 'Political events'}}, {'domain': {'id': '131', 'name': 'Unified Twitter Taxonomy', 'description': 'A taxonomy of user interests. '}, 'entity': {'id': '1518940645343125504', 'name': 'United States political events'}}, {'domain': {'id': '131', 'name': 'Unified Twitter Taxonomy', 'description': 'A taxonomy of user interests. '}, 'entity': {'id': '1526278121527205889', 'name': '2022 United States midterm elections'}}]",
2022-10-24 01:51:40+00:00,1584361956034899968,"We need all hands on deck in these next couple weeks. There are canvassing shifts available every day until Election Day.

Go to https://t.co/4ihF9l4yY4 and sign up for 2 shifts right now! 

Thank you, thank you, thank you. https://t.co/KjmQIoFMJM","[{'domain': {'id': '29', 'name': 'Events [Entity Service]', 'description': 'Real world events. '}, 'entity': {'id': '1526278121527205889', 'name': '2022 United States midterm elections'}}, {'domain': {'id': '38', 'name': 'Political Race', 'description': ''}, 'entity': {'id': '1526278121527205889', 'name': '2022 United States midterm elections'}}, {'domain': {'id': '131', 'name': 'Unified Twitter Taxonomy', 'description': 'A taxonomy of user interests. '}, 'entity': {'id': '847878884917886977', 'name': 'Politics', 'description': 'Politics'}}, {'domain': {'id': '131', 'name': 'Unified Twitter Taxonomy', 'description': 'A taxonomy of user interests. '}, 'entity': {'id': '1291447199595782144', 'name': 'United States politics'}}, {'domain': {'id': '131', 'name': 'Unified Twitter Taxonomy', 'description': 'A taxonomy of user interests. '}, 'entity': {'id': '1488973753274929152', 'name': 'Political events'}}, {'domain': {'id': '131', 'name': 'Unified Twitter Taxonomy', 'description': 'A taxonomy of user interests. '}, 'entity': {'id': '1518940645343125504', 'name': 'United States political events'}}, {'domain': {'id': '131', 'name': 'Unified Twitter Taxonomy', 'description': 'A taxonomy of user interests. '}, 'entity': {'id': '1526278121527205889', 'name': '2022 United States midterm elections'}}]",
2022-10-24 00:52:26+00:00,1584347048174063618,"RT @thedailybeast: As Trump-backed congressional candidate Joe Kent tells it, he made $122,110.36 last year as a “project manager” for a te…","[{'domain': {'id': '10', 'name': 'Person', 'description': 'Named people in the world like Nelson Mandela'}, 'entity': {'id': '799022225751871488', 'name': 'Donald Trump', 'description': '45th US President, Donald Trump'}}, {'domain': {'id': '29', 'name': 'Events [Entity Service]', 'description': 'Real world events. '}, 'entity': {'id': '1526278121527205889', 'name': '2022 United States midterm elections'}}, {'domain': {'id': '35', 'name': 'Politician', 'description': 'Politicians in the world, like Joe Biden'}, 'entity': {'id': '799022225751871488', 'name': 'Donald Trump', 'description': '45th US President, Donald Trump'}}, {'domain': {'id': '38', 'name': 'Political Race', 'description': ''}, 'entity': {'id': '1526278121527205889', 'name': '2022 United States midterm elections'}}, {'domain': {'id': '46', 'name': 'Business Taxonomy', 'description': 'Categories within Brand Verticals that narrow down the scope of Brands'}, 'entity': {'id': '1557696848252391426', 'name': 'Financial Services Business', 'description': 'Brands, companies, advertisers and every non-person handle with the profit intent related to Banks, Credit cards, Insurance, Investments, Stocks '}}, {'domain': {'id': '47', 'name': 'Brand', 'description': 'Brands and Companies'}, 'entity': {'id': '1139120266758377472', 'name': 'The Daily Beast'}}, {'domain': {'id': '65', 'name': 'Interests and Hobbies Vertical', 'description': 'Top level interests and hobbies groupings, like Food or Travel'}, 'entity': {'id': '781974596148793345', 'name': 'Business & finance'}}, {'domain': {'id': '65', 'name': 'Interests and Hobbies Vertical', 'description': 'Top level interests and hobbies groupings, like Food or Travel'}, 'entity': {'id': '847544972781826048', 'name': 'Careers', 'description': 'Careers'}}, {'domain': {'id': '66', 'name': 'Interests and Hobbies Category', 'description': 'A grouping of interests and hobbies entities, like Novelty Food or Destinations'}, 'entity': {'id': '961964676857790464', 'name': 'Project management', 'description': 'Project Management'}}, {'domain': {'id': '88', 'name': 'Political Body', 'description': 'A section of a government, like The Supreme Court'}, 'entity': {'id': '961705302700654593', 'name': 'United States Congress', 'description': 'United States Congress'}}, {'domain': {'id': '131', 'name': 'Unified Twitter Taxonomy', 'description': 'A taxonomy of user interests. '}, 'entity': {'id': '799022225751871488', 'name': 'Donald Trump', 'description': '45th US President, Donald Trump'}}, {'domain': {'id': '131', 'name': 'Unified Twitter Taxonomy', 'description': 'A taxonomy of user interests. '}, 'entity': {'id': '847878884917886977', 'name': 'Politics', 'description': 'Politics'}}, {'domain': {'id': '131', 'name': 'Unified Twitter Taxonomy', 'description': 'A taxonomy of user interests. '}, 'entity': {'id': '961705302700654593', 'name': 'United States Congress', 'description': 'United States Congress'}}, {'domain': {'id': '131', 'name': 'Unified Twitter Taxonomy', 'description': 'A taxonomy of user interests. '}, 'entity': {'id': '961964676857790464', 'name': 'Project management', 'description': 'Project Management'}}, {'domain': {'id': '131', 'name': 'Unified Twitter Taxonomy', 'description': 'A taxonomy of user interests. '}, 'entity': {'id': '1068583660914266113', 'name': 'Government institutions', 'description': 'Political Body'}}, {'domain': {'id': '131', 'name': 'Unified Twitter Taxonomy', 'description': 'A taxonomy of user interests. '}, 'entity': {'id': '1070032753834438656', 'name': 'Political figures', 'description': 'Politician'}}, {'domain': {'id': '131', 'name': 'Unified Twitter Taxonomy', 'description': 'A taxonomy of user interests. '}, 'entity': {'id': '1139120266758377472', 'name': 'The Daily Beast'}}, {'domain': {'id': '131', 'name': 'Unified Twitter Taxonomy', 'description': 'A taxonomy of user interests. '}, 'entity': {'id': '1272636957504356352', 'name': 'Business professions'}}, {'domain': {'id': '131', 'name': 'Unified Twitter Taxonomy', 'description': 'A taxonomy of user interests. '}, 'entity': {'id': '1291447199595782144', 'name': 'United States politics'}}, {'domain': {'id': '131', 'name': 'Unified Twitter Taxonomy', 'description': 'A taxonomy of user interests. '}, 'entity': {'id': '1488973753274929152', 'name': 'Political events'}}, {'domain': {'id': '131', 'name': 'Unified Twitter Taxonomy', 'description': 'A taxonomy of user interests. '}, 'entity': {'id': '1518940645343125504', 'name': 'United States political events'}}, {'domain': {'id': '131', 'name': 'Unified Twitter Taxonomy', 'description': 'A taxonomy of user interests. '}, 'entity': {'id': '1526278121527205889', 'name': '2022 United States midterm elections'}}]",
2022-10-23 23:25:31+00:00,1584325174069198848,"Joe Kent’s obsession with divisive culture wars may get him a lot of attention, but it’s not going to help people in this district. It’s not going to bring jobs home, support workers, or stop inflation.

We need a Member of Congress who knows this district &amp; has real solutions.","[{'domain': {'id': '29', 'name': 'Events [Entity Service]', 'description': 'Real world events. '}, 'entity': {'id': '1526278121527205889', 'name': '2022 United States midterm elections'}}, {'domain': {'id': '38', 'name': 'Political Race', 'description': ''}, 'entity': {'id': '1526278121527205889', 'name': '2022 United States midterm elections'}}, {'domain': {'id': '67', 'name': 'Interests and Hobbies', 'description': 'Interests, opinions, and behaviors of individuals, groups, or cultures; like Speciality Cooking or Theme Parks'}, 'entity': {'id': '1486458201117642754', 'name': 'Inflation'}}, {'domain': {'id': '131', 'name': 'Unified Twitter Taxonomy', 'description': 'A taxonomy of user interests. '}, 'entity': {'id': '847878884917886977', 'name': 'Politics', 'description': 'Politics'}}, {'domain': {'id': '131', 'name': 'Unified Twitter Taxonomy', 'description': 'A taxonomy of user interests. '}, 'entity': {'id': '900740740468191232', 'name': 'Political issues', 'description': 'Political issues'}}, {'domain': {'id': '131', 'name': 'Unified Twitter Taxonomy', 'description': 'A taxonomy of user interests. '}, 'entity': {'id': '1291447199595782144', 'name': 'United States politics'}}, {'domain': {'id': '131', 'name': 'Unified Twitter Taxonomy', 'description': 'A taxonomy of user interests. '}, 'entity': {'id': '1488973753274929152', 'name': 'Political events'}}, {'domain': {'id': '131', 'name': 'Unified Twitter Taxonomy', 'description': 'A taxonomy of user interests. '}, 'entity': {'id': '1518689897296453633', 'name': 'United States political issues'}}, {'domain': {'id': '131', 'name': 'Unified Twitter Taxonomy', 'description': 'A taxonomy of user interests. '}, 'entity': {'id': '1518940645343125504', 'name': 'United States political events'}}, {'domain': {'id': '131', 'name': 'Unified Twitter Taxonomy', 'description': 'A taxonomy of user interests. '}, 'entity': {'id': '1526278121527205889', 'name': '2022 United States midterm elections'}}, {'domain': {'id': '131', 'name': 'Unified Twitter Taxonomy', 'description': 'A taxonomy of user interests. '}, 'entity': {'id': '1559626214846869504', 'name': 'Inflation in the United States'}}]",
2022-10-22 20:29:18+00:00,1583918438392946689,You can find out about upcoming volunteer opportunities here: https://t.co/p4SULgTn7S https://t.co/pRMC8uJW2G,"[{'domain': {'id': '29', 'name': 'Events [Entity Service]', 'description': 'Real world events. '}, 'entity': {'id': '1526278121527205889', 'name': '2022 United States midterm elections'}}, {'domain': {'id': '38', 'name': 'Political Race', 'description': ''}, 'entity': {'id': '1526278121527205889', 'name': '2022 United States midterm elections'}}, {'domain': {'id': '131', 'name': 'Unified Twitter Taxonomy', 'description': 'A taxonomy of user interests. '}, 'entity': {'id': '847878884917886977', 'name': 'Politics', 'description': 'Politics'}}, {'domain': {'id': '131', 'name': 'Unified Twitter Taxonomy', 'description': 'A taxonomy of user interests. '}, 'entity': {'id': '1291447199595782144', 'name': 'United States politics'}}, {'domain': {'id': '131', 'name': 'Unified Twitter Taxonomy', 'description': 'A taxonomy of user interests. '}, 'entity': {'id': '1488973753274929152', 'name': 'Political events'}}, {'domain': {'id': '131', 'name': 'Unified Twitter Taxonomy', 'description': 'A taxonomy of user interests. '}, 'entity': {'id': '1518940645343125504', 'name': 'United States political events'}}, {'domain': {'id': '131', 'name': 'Unified Twitter Taxonomy', 'description': 'A taxonomy of user interests. '}, 'entity': {'id': '1526278121527205889', 'name': '2022 United States midterm elections'}}]",
2022-10-22 20:29:03+00:00,1583918377776873472,"Ballots have started arriving in mailboxes! This is crunch time. This race will come down to how many voters we can reach over the next few weeks. 

We will defeat Kent and #FlipWA03, but only with your support. Chip in to fund our voter outreach efforts: https://t.co/iQsEmAa5kB","[{'domain': {'id': '29', 'name': 'Events [Entity Service]', 'description': 'Real world events. '}, 'entity': {'id': '1526278121527205889', 'name': '2022 United States midterm elections'}}, {'domain': {'id': '38', 'name': 'Political Race', 'description': ''}, 'entity': {'id': '1526278121527205889', 'name': '2022 United States midterm elections'}}, {'domain': {'id': '131', 'name': 'Unified Twitter Taxonomy', 'description': 'A taxonomy of user interests. '}, 'entity': {'id': '847878884917886977', 'name': 'Politics', 'description': 'Politics'}}, {'domain': {'id': '131', 'name': 'Unified Twitter Taxonomy', 'description': 'A taxonomy of user interests. '}, 'entity': {'id': '1291447199595782144', 'name': 'United States politics'}}, {'domain': {'id': '131', 'name': 'Unified Twitter Taxonomy', 'description': 'A taxonomy of user interests. '}, 'entity': {'id': '1488973753274929152', 'name': 'Political events'}}, {'domain': {'id': '131', 'name': 'Unified Twitter Taxonomy', 'description': 'A taxonomy of user interests. '}, 'entity': {'id': '1518940645343125504', 'name': 'United States political events'}}, {'domain': {'id': '131', 'name': 'Unified Twitter Taxonomy', 'description': 'A taxonomy of user interests. '}, 'entity': {'id': '1526278121527205889', 'name': '2022 United States midterm elections'}}]",
2022-10-22 01:29:29+00:00,1583631596011540481,Voting is a fundamental part of our democracy &amp; candidates like Joe Kent are putting our rights at risk. So thankful for everyone who came out despite the rain to stand up for Southwest Washington. https://t.co/5rL3pTePSL,"[{'domain': {'id': '29', 'name': 'Events [Entity Service]', 'description': 'Real world events. '}, 'entity': {'id': '1526278121527205889', 'name': '2022 United States midterm elections'}}, {'domain': {'id': '38', 'name': 'Political Race', 'description': ''}, 'entity': {'id': '1526278121527205889', 'name': '2022 United States midterm elections'}}, {'domain': {'id': '131', 'name': 'Unified Twitter Taxonomy', 'description': 'A taxonomy of user interests. '}, 'entity': {'id': '847878884917886977', 'name': 'Politics', 'description': 'Politics'}}, {'domain': {'id': '131', 'name': 'Unified Twitter Taxonomy', 'description': 'A taxonomy of user interests. '}, 'entity': {'id': '1291447199595782144', 'name': 'United States politics'}}, {'domain': {'id': '131', 'name': 'Unified Twitter Taxonomy', 'description': 'A taxonomy of user interests. '}, 'entity': {'id': '1488973753274929152', 'name': 'Political events'}}, {'domain': {'id': '131', 'name': 'Unified Twitter Taxonomy', 'description': 'A taxonomy of user interests. '}, 'entity': {'id': '1518940645343125504', 'name': 'United States political events'}}, {'domain': {'id': '131', 'name': 'Unified Twitter Taxonomy', 'description': 'A taxonomy of user interests. '}, 'entity': {'id': '1526278121527205889', 'name': '2022 United States midterm elections'}}]",
2022-10-21 23:20:49+00:00,1583599213585522688,"Rain or shine, we’re rallying for our voting rights. Music starts at 4:45, see you soon! https://t.co/0KDh6zwLv8","[{'domain': {'id': '29', 'name': 'Events [Entity Service]', 'description': 'Real world events. '}, 'entity': {'id': '1526278121527205889', 'name': '2022 United States midterm elections'}}, {'domain': {'id': '38', 'name': 'Political Race', 'description': ''}, 'entity': {'id': '1526278121527205889', 'name': '2022 United States midterm elections'}}, {'domain': {'id': '131', 'name': 'Unified Twitter Taxonomy', 'description': 'A taxonomy of user interests. '}, 'entity': {'id': '847878884917886977', 'name': 'Politics', 'description': 'Politics'}}, {'domain': {'id': '131', 'name': 'Unified Twitter Taxonomy', 'description': 'A taxonomy of user interests. '}, 'entity': {'id': '1291447199595782144', 'name': 'United States politics'}}, {'domain': {'id': '131', 'name': 'Unified Twitter Taxonomy', 'description': 'A taxonomy of user interests. '}, 'entity': {'id': '1488973753274929152', 'name': 'Political events'}}, {'domain': {'id': '131', 'name': 'Unified Twitter Taxonomy', 'description': 'A taxonomy of user interests. '}, 'entity': {'id': '1518940645343125504', 'name': 'United States political events'}}, {'domain': {'id': '131', 'name': 'Unified Twitter Taxonomy', 'description': 'A taxonomy of user interests. '}, 'entity': {'id': '1526278121527205889', 'name': '2022 United States midterm elections'}}]",
2022-10-21 21:05:29+00:00,1583565159783890944,"My 2 cents: Rent is already too damn high for many who are struggling to put food on the table. Eliminating competition will force more families and workers into housing insecurity and homelessness.
https://t.co/nhOxsaS5wV","[{'domain': {'id': '29', 'name': 'Events [Entity Service]', 'description': 'Real world events. '}, 'entity': {'id': '1526278121527205889', 'name': '2022 United States midterm elections'}}, {'domain': {'id': '38', 'name': 'Political Race', 'description': ''}, 'entity': {'id': '1526278121527205889', 'name': '2022 United States midterm elections'}}, {'domain': {'id': '131', 'name': 'Unified Twitter Taxonomy', 'description': 'A taxonomy of user interests. '}, 'entity': {'id': '847878884917886977', 'name': 'Politics', 'description': 'Politics'}}, {'domain': {'id': '131', 'name': 'Unified Twitter Taxonomy', 'description': 'A taxonomy of user interests. '}, 'entity': {'id': '1291447199595782144', 'name': 'United States politics'}}, {'domain': {'id': '131', 'name': 'Unified Twitter Taxonomy', 'description': 'A taxonomy of user interests. '}, 'entity': {'id': '1488973753274929152', 'name': 'Political events'}}, {'domain': {'id': '131', 'name': 'Unified Twitter Taxonomy', 'description': 'A taxonomy of user interests. '}, 'entity': {'id': '1518940645343125504', 'name': 'United States political events'}}, {'domain': {'id': '131', 'name': 'Unified Twitter Taxonomy', 'description': 'A taxonomy of user interests. '}, 'entity': {'id': '1526278121527205889', 'name': '2022 United States midterm elections'}}]",
