created_at,id,text,context_annotations,geo
2023-07-09 21:57:35+00:00,1678161500995977217,"RT @WAStateStandard: In an interview with @WAStateStandard, @RepMGP weighs in on gas prices, electric vehicles, and energy policy. (by @dos…","[{'domain': {'id': '45', 'name': 'Brand Vertical', 'description': 'Top level entities that describe a Brands industry'}, 'entity': {'id': '781974597302226944', 'name': 'Transportation'}}, {'domain': {'id': '46', 'name': 'Business Taxonomy', 'description': 'Categories within Brand Verticals that narrow down the scope of Brands'}, 'entity': {'id': '1557696420500541440', 'name': 'Automotive, Aircraft & Boat Business', 'description': 'Brands, companies, advertisers and every non-person handle with the profit intent related to automobile, spacecraft, aircraft and boat manufacturing'}}, {'domain': {'id': '46', 'name': 'Business Taxonomy', 'description': 'Categories within Brand Verticals that narrow down the scope of Brands'}, 'entity': {'id': '1557697333571112960', 'name': 'Technology Business', 'description': 'Brands, companies, advertisers and every non-person handle with the profit intent related to softwares, apps, communication equipments, hardwares'}}, {'domain': {'id': '46', 'name': 'Business Taxonomy', 'description': 'Categories within Brand Verticals that narrow down the scope of Brands'}, 'entity': {'id': '1557697439489880065', 'name': 'Travel & Transportation Business', 'description': 'Brands, companies, advertisers and every non-person handle with the profit intent related to travel as airlines, travel agencies, hotels'}}, {'domain': {'id': '30', 'name': 'Entities [Entity Service]', 'description': 'Entity Service top level domain, every item that is in Entity Service should be in this domain'}, 'entity': {'id': '848920371311001600', 'name': 'Technology', 'description': 'Technology and computing'}}, {'domain': {'id': '131', 'name': 'Unified Twitter Taxonomy', 'description': 'A taxonomy of user interests. '}, 'entity': {'id': '781974597302226944', 'name': 'Transportation'}}, {'domain': {'id': '131', 'name': 'Unified Twitter Taxonomy', 'description': 'A taxonomy of user interests. '}, 'entity': {'id': '839159814991167489', 'name': 'Travel', 'description': 'Travel'}}, {'domain': {'id': '131', 'name': 'Unified Twitter Taxonomy', 'description': 'A taxonomy of user interests. '}, 'entity': {'id': '847528391163092993', 'name': 'Automotive', 'description': 'Car culture'}}, {'domain': {'id': '131', 'name': 'Unified Twitter Taxonomy', 'description': 'A taxonomy of user interests. '}, 'entity': {'id': '1362135345043673092', 'name': 'Electric vehicles'}}, {'domain': {'id': '165', 'name': 'Technology', 'description': 'for individual and types of technology, e.g., food technology, 3D printing'}, 'entity': {'id': '848920371311001600', 'name': 'Technology', 'description': 'Technology and computing'}}, {'domain': {'id': '65', 'name': 'Interests and Hobbies Vertical', 'description': 'Top level interests and hobbies groupings, like Food or Travel'}, 'entity': {'id': '847528391163092993', 'name': 'Automotive', 'description': 'Car culture'}}, {'domain': {'id': '66', 'name': 'Interests and Hobbies Category', 'description': 'A grouping of interests and hobbies entities, like Novelty Food or Destinations'}, 'entity': {'id': '847528576551337984', 'name': 'Hybrid and electric vehicles', 'description': 'Hybrid and electric vehicles'}}]",
2023-07-09 03:29:04+00:00,1677882533667831808,"RT @buildtheera: Possibly the best quote ever about building infrastructure.  ❤️ 
Thank you @MGPforCongress",[],
2023-07-09 03:25:52+00:00,1677881730630565889,"✅ $40 million secured for the Washougal 32nd Street underpass. This will eliminate a busy railroad crossing, speed up emergency response times, and ease congestion on SR-14.

Bringing our tax dollars home to Southwest Washington is my priority. Next up: I-5 bridge replacement https://t.co/PvxeH9IqoU","[{'domain': {'id': '67', 'name': 'Interests and Hobbies', 'description': 'Interests, opinions, and behaviors of individuals, groups, or cultures; like Speciality Cooking or Theme Parks'}, 'entity': {'id': '1037076073719025664', 'name': 'Traffic', 'description': 'Traffic'}}]",
2023-07-03 15:49:05+00:00,1675894440404357120,"More firefighting resources arriving in Skamania County today. Grateful for the crews responding and working to contain the #Tunnel5Fire 

Follow these accounts for updates ⤵️ https://t.co/Oq1JKSzU8s","[{'domain': {'id': '66', 'name': 'Interests and Hobbies Category', 'description': 'A grouping of interests and hobbies entities, like Novelty Food or Destinations'}, 'entity': {'id': '1237472346560053249', 'name': 'Firefighting'}}, {'domain': {'id': '131', 'name': 'Unified Twitter Taxonomy', 'description': 'A taxonomy of user interests. '}, 'entity': {'id': '1237472346560053249', 'name': 'Firefighting'}}]",
2023-07-02 22:26:36+00:00,1675632087628677122,RT @waDNR_fire: #WaWILDFIRE UPDATE #Tunnel5Fire 75+ acres and growing. Level 3 evacuations ordered by Skamania County Sheriff. Those under…,[],
2023-06-24 19:02:36+00:00,1672681648729608192,"Abortions are healthcare, period. And no matter what, I will always fight for choice and access in Washington and for every person across the country.",[],
2023-06-24 18:35:24+00:00,1672674801540841480,"Today marks the 1 year anniversary of Dobbs v Jackson – the day that the Supreme Court put politics over women’s health and the right to bodily autonomy by overturning Roe v Wade. Like so many other rural communities, in WA3 we know how hard it is to get the healthcare we need.","[{'domain': {'id': '131', 'name': 'Unified Twitter Taxonomy', 'description': 'A taxonomy of user interests. '}, 'entity': {'id': '847878884917886977', 'name': 'Politics', 'description': 'Politics'}}, {'domain': {'id': '131', 'name': 'Unified Twitter Taxonomy', 'description': 'A taxonomy of user interests. '}, 'entity': {'id': '900740740468191232', 'name': 'Political issues', 'description': 'Political issues'}}, {'domain': {'id': '131', 'name': 'Unified Twitter Taxonomy', 'description': 'A taxonomy of user interests. '}, 'entity': {'id': '1046545033657081857', 'name': 'News', 'description': 'News'}}, {'domain': {'id': '131', 'name': 'Unified Twitter Taxonomy', 'description': 'A taxonomy of user interests. '}, 'entity': {'id': '1521295104438284288', 'name': 'Reproductive Rights in the United States'}}, {'domain': {'id': '131', 'name': 'Unified Twitter Taxonomy', 'description': 'A taxonomy of user interests. '}, 'entity': {'id': '847878884917886977', 'name': 'Politics', 'description': 'Politics'}}, {'domain': {'id': '131', 'name': 'Unified Twitter Taxonomy', 'description': 'A taxonomy of user interests. '}, 'entity': {'id': '900740740468191232', 'name': 'Political issues', 'description': 'Political issues'}}]",
2023-06-21 18:11:32+00:00,1671581632334012416,"RT @_OneCountry_: The #FarmBill, which governs our nation’s agriculture &amp; food security, is up for re-authorization. @RepMGP joined the #Ho…",[],
2023-06-21 15:12:43+00:00,1671536630992191488,Too often politicians get caught up in culture wars and only listen to the loudest voices. I joined @HeidiHeitkamp &amp; @JoelKFGO on the @_OneCountry_ #HotDishPod to talk about getting back to good governance that reflects rural values. Listen here: https://t.co/lhv8KCA30V https://t.co/A3DwGuJas4,[],
2023-06-19 16:01:00+00:00,1670824007292055558,"Today we celebrate #Juneteenth to honor the end of slavery and recommit ourselves to the fight for true freedom, justice, and equality for ALL.","[{'domain': {'id': '29', 'name': 'Events [Entity Service]', 'description': 'Real world events. '}, 'entity': {'id': '1270453235480854528', 'name': 'Juneteenth', 'description': 'Juneteenth, the holiday commemorating the day that all enslaved people in the US learned they were free, is being celebrated this year with marches, music and more.'}}, {'domain': {'id': '119', 'name': 'Holiday', 'description': 'Holidays like Christmas or Halloween'}, 'entity': {'id': '1270453235480854528', 'name': 'Juneteenth', 'description': 'Juneteenth, the holiday commemorating the day that all enslaved people in the US learned they were free, is being celebrated this year with marches, music and more.'}}, {'domain': {'id': '131', 'name': 'Unified Twitter Taxonomy', 'description': 'A taxonomy of user interests. '}, 'entity': {'id': '913061256646377473', 'name': 'Black Lives Matter', 'description': 'Black Lives Matter is an international activist movement, originating in the African-American community, that campaigns against violence and systemic racism towards black people.'}}, {'domain': {'id': '29', 'name': 'Events [Entity Service]', 'description': 'Real world events. '}, 'entity': {'id': '1270453235480854528', 'name': 'Juneteenth', 'description': 'Juneteenth, the holiday commemorating the day that all enslaved people in the US learned they were free, is being celebrated this year with marches, music and more.'}}, {'domain': {'id': '119', 'name': 'Holiday', 'description': 'Holidays like Christmas or Halloween'}, 'entity': {'id': '1270453235480854528', 'name': 'Juneteenth', 'description': 'Juneteenth, the holiday commemorating the day that all enslaved people in the US learned they were free, is being celebrated this year with marches, music and more.'}}]",
2023-06-18 17:08:00+00:00,1670478479706689536,"Happy Father’s Day, Washington! Today, I’m thankful for my husband Dean and the life &amp; family we’ve built together. https://t.co/cXZobuZEf4","[{'domain': {'id': '29', 'name': 'Events [Entity Service]', 'description': 'Real world events. '}, 'entity': {'id': '1253282101387857921', 'name': ""Father's Day "", 'description': ""All conversations for all years for Father's Day""}}, {'domain': {'id': '119', 'name': 'Holiday', 'description': 'Holidays like Christmas or Halloween'}, 'entity': {'id': '1253282101387857921', 'name': ""Father's Day "", 'description': ""All conversations for all years for Father's Day""}}, {'domain': {'id': '131', 'name': 'Unified Twitter Taxonomy', 'description': 'A taxonomy of user interests. '}, 'entity': {'id': '847547282010497024', 'name': 'Parenting', 'description': 'Family and parenting'}}, {'domain': {'id': '131', 'name': 'Unified Twitter Taxonomy', 'description': 'A taxonomy of user interests. '}, 'entity': {'id': '1253282101387857921', 'name': ""Father's Day "", 'description': ""All conversations for all years for Father's Day""}}, {'domain': {'id': '131', 'name': 'Unified Twitter Taxonomy', 'description': 'A taxonomy of user interests. '}, 'entity': {'id': '1291095284756357120', 'name': 'Cultural events'}}, {'domain': {'id': '131', 'name': 'Unified Twitter Taxonomy', 'description': 'A taxonomy of user interests. '}, 'entity': {'id': '1436053202835689485', 'name': 'Events'}}]",
2023-06-15 17:21:00+00:00,1669394587947761665,"Happy Pride, Washington 🏳️‍🌈I hope everyone has a wonderful month celebrating the LGBTQIA+ community, the progress we’ve made, and the fight we still have to win for equality and justice",[],
2023-06-14 20:39:00+00:00,1669082028107788290,"Like many parents &amp; small business owners in WA03, Dean and I often took Ciro to work with us because that was the only option. Now, with this bipartisan bill, childcare will be more accessible &amp; affordable so families get the help they need, no matter where they live.","[{'domain': {'id': '46', 'name': 'Business Taxonomy', 'description': 'Categories within Brand Verticals that narrow down the scope of Brands'}, 'entity': {'id': '1557696848252391426', 'name': 'Financial Services Business', 'description': 'Brands, companies, advertisers and every non-person handle with the profit intent related to Banks, Credit cards, Insurance, Investments, Stocks '}}, {'domain': {'id': '66', 'name': 'Interests and Hobbies Category', 'description': 'A grouping of interests and hobbies entities, like Novelty Food or Destinations'}, 'entity': {'id': '857878891611865089', 'name': 'Small business', 'description': 'Small business'}}, {'domain': {'id': '131', 'name': 'Unified Twitter Taxonomy', 'description': 'A taxonomy of user interests. '}, 'entity': {'id': '781974596148793345', 'name': 'Business & finance'}}, {'domain': {'id': '131', 'name': 'Unified Twitter Taxonomy', 'description': 'A taxonomy of user interests. '}, 'entity': {'id': '857878891611865089', 'name': 'Small business', 'description': 'Small business'}}, {'domain': {'id': '131', 'name': 'Unified Twitter Taxonomy', 'description': 'A taxonomy of user interests. '}, 'entity': {'id': '1503733786608955394', 'name': 'Small and medium-sized business'}}, {'domain': {'id': '131', 'name': 'Unified Twitter Taxonomy', 'description': 'A taxonomy of user interests. '}, 'entity': {'id': '1584573725449408513', 'name': 'Businesses by size'}}]",
2023-06-14 20:32:14+00:00,1669080326197374979,I introduced the Expanding Childcare in Rural America Act because childcare in communities like ours is nearly impossible to find &amp; afford. But it shouldn’t be 1/2 🧵,"[{'domain': {'id': '89', 'name': 'Music Album', 'description': 'A music album like The Dark Side of the Moon'}, 'entity': {'id': '1565371771821248513', 'name': 'BE: 1'}}, {'domain': {'id': '131', 'name': 'Unified Twitter Taxonomy', 'description': 'A taxonomy of user interests. '}, 'entity': {'id': '1456009988623663105', 'name': 'BE:FIRST', 'description': 'BOYS AND MEN'}}]",
2023-06-13 20:13:20+00:00,1668713181856841728,Is the ESG cartel in the room with us right now Joe? https://t.co/mN1bv8e8az,[],
2023-05-24 23:07:09+00:00,1661509165523640326,"Teams get shit done, so I’m teaming up with Jared Golden and Mary Peltola to rebuild the Blue Dogs into something useful for working people. We know who we are, and we know how to win.

Congress needs more people like us, and a lot fewer weirdos with white nationalist friends. https://t.co/afs1s9dX0o","[{'domain': {'id': '10', 'name': 'Person', 'description': 'Named people in the world like Nelson Mandela'}, 'entity': {'id': '1036973136405643264', 'name': 'Jared Golden', 'description': 'Candidate for Representative from Maine, Jared Golden'}}, {'domain': {'id': '35', 'name': 'Politician', 'description': 'Politicians in the world, like Joe Biden'}, 'entity': {'id': '1036973136405643264', 'name': 'Jared Golden', 'description': 'Candidate for Representative from Maine, Jared Golden'}}, {'domain': {'id': '131', 'name': 'Unified Twitter Taxonomy', 'description': 'A taxonomy of user interests. '}, 'entity': {'id': '847878884917886977', 'name': 'Politics', 'description': 'Politics'}}, {'domain': {'id': '131', 'name': 'Unified Twitter Taxonomy', 'description': 'A taxonomy of user interests. '}, 'entity': {'id': '1036973136405643264', 'name': 'Jared Golden', 'description': 'Candidate for Representative from Maine, Jared Golden'}}, {'domain': {'id': '131', 'name': 'Unified Twitter Taxonomy', 'description': 'A taxonomy of user interests. '}, 'entity': {'id': '1070032753834438656', 'name': 'Political figures', 'description': 'Politician'}}]",
2023-05-17 21:16:29+00:00,1658944601363824644,"Rural community health care needs are often overlooked, but I’m not taking no for an answer in the House. I’m working around the clock to ensure that women have the right to control our own bodies no matter what.","[{'domain': {'id': '65', 'name': 'Interests and Hobbies Vertical', 'description': 'Top level interests and hobbies groupings, like Food or Travel'}, 'entity': {'id': '903303816698671104', 'name': 'Wellness and health', 'description': 'Wellness & Health'}}, {'domain': {'id': '66', 'name': 'Interests and Hobbies Category', 'description': 'A grouping of interests and hobbies entities, like Novelty Food or Destinations'}, 'entity': {'id': '918538847302041600', 'name': 'Community Health', 'description': 'Community Health'}}]",
2023-05-17 21:16:28+00:00,1658944599866449921,Sunday kicked off National Women’s Health Week &amp; no one knows the importance of health care access better than we do in WA03.,[],
2023-05-16 20:39:45+00:00,1658572971236118552,"Joe Kent is commemorating National Police Week by calling to defund the FBI, in case you thought his campaign would be any less weird this time around. https://t.co/7G81BF0IBB","[{'domain': {'id': '88', 'name': 'Political Body', 'description': 'A section of a government, like The Supreme Court'}, 'entity': {'id': '937710668706299904', 'name': 'Federal Bureau of Investigation', 'description': 'All conversation about the United States Federal Bureau of Investigation'}}, {'domain': {'id': '131', 'name': 'Unified Twitter Taxonomy', 'description': 'A taxonomy of user interests. '}, 'entity': {'id': '847878884917886977', 'name': 'Politics', 'description': 'Politics'}}, {'domain': {'id': '131', 'name': 'Unified Twitter Taxonomy', 'description': 'A taxonomy of user interests. '}, 'entity': {'id': '937710668706299904', 'name': 'Federal Bureau of Investigation', 'description': 'All conversation about the United States Federal Bureau of Investigation'}}, {'domain': {'id': '131', 'name': 'Unified Twitter Taxonomy', 'description': 'A taxonomy of user interests. '}, 'entity': {'id': '1068583660914266113', 'name': 'Government institutions', 'description': 'Political Body'}}]",
2023-05-15 00:01:13+00:00,1657898895345860610,"Happy Mother’s Day to all of the moms and caregivers in WA03! I’m thankful that I’m with Dean and Ciro today, as I know not everyone can celebrate with their families. I hope everyone has a wonderful day ❤️","[{'domain': {'id': '29', 'name': 'Events [Entity Service]', 'description': 'Real world events. '}, 'entity': {'id': '1238036059402821633', 'name': ""Mother's Day"", 'description': ""This Mother's Day entity will include all conversations for all years ""}}, {'domain': {'id': '29', 'name': 'Events [Entity Service]', 'description': 'Real world events. '}, 'entity': {'id': '1238036059402821633', 'name': ""Mother's Day"", 'description': ""This Mother's Day entity will include all conversations for all years ""}}, {'domain': {'id': '29', 'name': 'Events [Entity Service]', 'description': 'Real world events. '}, 'entity': {'id': '1253277008647172096', 'name': ""Mother's Day France"", 'description': ""This entity for Mother's Day France for all years ""}}, {'domain': {'id': '29', 'name': 'Events [Entity Service]', 'description': 'Real world events. '}, 'entity': {'id': '1355159817241849861', 'name': ""Mother's Day UK"", 'description': ""this entity for all conversations for Mother's Day UK all year""}}, {'domain': {'id': '65', 'name': 'Interests and Hobbies Vertical', 'description': 'Top level interests and hobbies groupings, like Food or Travel'}, 'entity': {'id': '864925500627484672', 'name': 'Family and life stages', 'description': 'Family and Life Stages'}}, {'domain': {'id': '66', 'name': 'Interests and Hobbies Category', 'description': 'A grouping of interests and hobbies entities, like Novelty Food or Destinations'}, 'entity': {'id': '1092545020932976640', 'name': 'Caregiving', 'description': 'Caregiving'}}, {'domain': {'id': '119', 'name': 'Holiday', 'description': 'Holidays like Christmas or Halloween'}, 'entity': {'id': '1238036059402821633', 'name': ""Mother's Day"", 'description': ""This Mother's Day entity will include all conversations for all years ""}}, {'domain': {'id': '119', 'name': 'Holiday', 'description': 'Holidays like Christmas or Halloween'}, 'entity': {'id': '1253277008647172096', 'name': ""Mother's Day France"", 'description': ""This entity for Mother's Day France for all years ""}}, {'domain': {'id': '119', 'name': 'Holiday', 'description': 'Holidays like Christmas or Halloween'}, 'entity': {'id': '1355159817241849861', 'name': ""Mother's Day UK"", 'description': ""this entity for all conversations for Mother's Day UK all year""}}, {'domain': {'id': '131', 'name': 'Unified Twitter Taxonomy', 'description': 'A taxonomy of user interests. '}, 'entity': {'id': '1291095284756357120', 'name': 'Cultural events'}}, {'domain': {'id': '131', 'name': 'Unified Twitter Taxonomy', 'description': 'A taxonomy of user interests. '}, 'entity': {'id': '1436053202835689485', 'name': 'Events'}}]",
2023-05-13 15:55:42+00:00,1657414324011294720,"RT @SpokesmanReview: Backed by former auto shop owner, ‘right-to-repair’ bills pick up steam in Congress, statehouses https://t.co/yI5vt4Z1…",[],
2023-05-11 22:46:57+00:00,1656793040676167681,"Here’s the transcript:

https://t.co/RzgLHGIUVe https://t.co/NTW8VjpRzn",[],
2023-05-11 22:45:42+00:00,1656792726094897152,"Joe Kent’s back for another run and he’s got the same extreme plan: close all our borders to all immigration for the next 20 years in order to re-establish a white majority.

Southwest Washington rejected his garbage ideas in 2022 and we’ll do it again in 2024. https://t.co/7nX10tauDU https://t.co/wXL3DDZl0R","[{'domain': {'id': '131', 'name': 'Unified Twitter Taxonomy', 'description': 'A taxonomy of user interests. '}, 'entity': {'id': '847878884917886977', 'name': 'Politics', 'description': 'Politics'}}, {'domain': {'id': '131', 'name': 'Unified Twitter Taxonomy', 'description': 'A taxonomy of user interests. '}, 'entity': {'id': '900740740468191232', 'name': 'Political issues', 'description': 'Political issues'}}, {'domain': {'id': '131', 'name': 'Unified Twitter Taxonomy', 'description': 'A taxonomy of user interests. '}, 'entity': {'id': '1291447199595782144', 'name': 'United States politics'}}, {'domain': {'id': '131', 'name': 'Unified Twitter Taxonomy', 'description': 'A taxonomy of user interests. '}, 'entity': {'id': '1518689897296453633', 'name': 'United States political issues'}}, {'domain': {'id': '131', 'name': 'Unified Twitter Taxonomy', 'description': 'A taxonomy of user interests. '}, 'entity': {'id': '1561888608839053314', 'name': 'Immigration to the United States'}}]",
2023-04-27 23:28:54+00:00,1651730166463496193,"I ran for Congress to build a better future for my son &amp; every kid across the country – one where they can afford a good life &amp; everything they need, whether they work in Congress or an auto shop. https://t.co/qENbSsVP6M",[],
2023-04-27 23:28:53+00:00,1651730165343584256,"Today is Take Your Child To Work Day, an incredible opportunity for kids to dream about their futures. But for me &amp; countless other families, this could be a normal day because of one simple fact: child care is way too expensive. And it shouldn’t be!",[],
2023-04-27 21:12:29+00:00,1651695839562330113,"RT @LetAmericaVote: In Washington’s 3rd Congressional District, we’re proud to endorse #NoCorporatePAC candidate Rep. @MGPforCongress for r…",[],
2023-04-25 21:35:04+00:00,1650976743837286400,Great news! This is progress. Now let's make it true across the nation...💪💪💪 #RightToRepair https://t.co/X5LmrUal7t,"[{'domain': {'id': '159', 'name': 'States', 'description': 'States, provinces, or prefectures, like California or Fukushima Prefecture'}, 'entity': {'id': '856862177474433024', 'name': 'Colorado', 'description': 'Colorado'}}]",
2023-04-23 00:03:45+00:00,1649926997890707456,"As someone who lives in an old growth forest and still heats their house from wood, I understand the threat climate change poses to our rural community. That's why I'm working to get things done for our community on the bipartisan coalition to extend forest restoration #EarthDay https://t.co/nnxzLu2JU4","[{'domain': {'id': '29', 'name': 'Events [Entity Service]', 'description': 'Real world events. '}, 'entity': {'id': '1231938152383668224', 'name': 'Earth Day', 'description': 'This entity covers all conversations for all years for Earth Day'}}, {'domain': {'id': '119', 'name': 'Holiday', 'description': 'Holidays like Christmas or Halloween'}, 'entity': {'id': '1231938152383668224', 'name': 'Earth Day', 'description': 'This entity covers all conversations for all years for Earth Day'}}, {'domain': {'id': '131', 'name': 'Unified Twitter Taxonomy', 'description': 'A taxonomy of user interests. '}, 'entity': {'id': '847548225712119808', 'name': 'Holidays', 'description': 'Holidays'}}, {'domain': {'id': '131', 'name': 'Unified Twitter Taxonomy', 'description': 'A taxonomy of user interests. '}, 'entity': {'id': '854692455005921281', 'name': 'Science', 'description': 'Science'}}, {'domain': {'id': '131', 'name': 'Unified Twitter Taxonomy', 'description': 'A taxonomy of user interests. '}, 'entity': {'id': '1248631349096767488', 'name': 'Environmentalism'}}, {'domain': {'id': '131', 'name': 'Unified Twitter Taxonomy', 'description': 'A taxonomy of user interests. '}, 'entity': {'id': '1265415402915393537', 'name': 'Climate change'}}, {'domain': {'id': '131', 'name': 'Unified Twitter Taxonomy', 'description': 'A taxonomy of user interests. '}, 'entity': {'id': '1278017316656082945', 'name': 'Green living'}}, {'domain': {'id': '131', 'name': 'Unified Twitter Taxonomy', 'description': 'A taxonomy of user interests. '}, 'entity': {'id': '1291095284756357120', 'name': 'Cultural events'}}, {'domain': {'id': '131', 'name': 'Unified Twitter Taxonomy', 'description': 'A taxonomy of user interests. '}, 'entity': {'id': '1436053202835689485', 'name': 'Events'}}]",
