created_at,id,text,context_annotations,geo
2022-11-13 02:41:50+00:00,1591622335194595328,"This race was a bellwether for the direction of our country. Joe Kent gave voice to some of the darkest impulses in our politics: white nationalism, xenophobia, and authoritarianism.

Southwest Washington looked them straight in the eye and said no — not here, not now, not ever.","[{'domain': {'id': '29', 'name': 'Events [Entity Service]', 'description': 'Real world events. '}, 'entity': {'id': '1526278121527205889', 'name': '2022 United States midterm elections'}}, {'domain': {'id': '38', 'name': 'Political Race', 'description': ''}, 'entity': {'id': '1526278121527205889', 'name': '2022 United States midterm elections'}}, {'domain': {'id': '131', 'name': 'Unified Twitter Taxonomy', 'description': 'A taxonomy of user interests. '}, 'entity': {'id': '847878884917886977', 'name': 'Politics', 'description': 'Politics'}}, {'domain': {'id': '131', 'name': 'Unified Twitter Taxonomy', 'description': 'A taxonomy of user interests. '}, 'entity': {'id': '1046545033657081857', 'name': 'News', 'description': 'News'}}, {'domain': {'id': '131', 'name': 'Unified Twitter Taxonomy', 'description': 'A taxonomy of user interests. '}, 'entity': {'id': '1291447199595782144', 'name': 'United States politics'}}, {'domain': {'id': '131', 'name': 'Unified Twitter Taxonomy', 'description': 'A taxonomy of user interests. '}, 'entity': {'id': '1488973753274929152', 'name': 'Political events'}}, {'domain': {'id': '131', 'name': 'Unified Twitter Taxonomy', 'description': 'A taxonomy of user interests. '}, 'entity': {'id': '1518940645343125504', 'name': 'United States political events'}}, {'domain': {'id': '131', 'name': 'Unified Twitter Taxonomy', 'description': 'A taxonomy of user interests. '}, 'entity': {'id': '1526278121527205889', 'name': '2022 United States midterm elections'}}]",
2022-11-13 01:53:47+00:00,1591610245146906624,"We won. I am humbled, honored, and grateful.

I pledge to work every day to live up to the responsibility placed in me.

I will defend our rights. I will protect our democracy. And I will deliver the help working and middle class families need.

Thank you, thank you, thank you.","[{'domain': {'id': '29', 'name': 'Events [Entity Service]', 'description': 'Real world events. '}, 'entity': {'id': '1526278121527205889', 'name': '2022 United States midterm elections'}}, {'domain': {'id': '38', 'name': 'Political Race', 'description': ''}, 'entity': {'id': '1526278121527205889', 'name': '2022 United States midterm elections'}}, {'domain': {'id': '131', 'name': 'Unified Twitter Taxonomy', 'description': 'A taxonomy of user interests. '}, 'entity': {'id': '847878884917886977', 'name': 'Politics', 'description': 'Politics'}}, {'domain': {'id': '131', 'name': 'Unified Twitter Taxonomy', 'description': 'A taxonomy of user interests. '}, 'entity': {'id': '1291447199595782144', 'name': 'United States politics'}}, {'domain': {'id': '131', 'name': 'Unified Twitter Taxonomy', 'description': 'A taxonomy of user interests. '}, 'entity': {'id': '1488973753274929152', 'name': 'Political events'}}, {'domain': {'id': '131', 'name': 'Unified Twitter Taxonomy', 'description': 'A taxonomy of user interests. '}, 'entity': {'id': '1518940645343125504', 'name': 'United States political events'}}, {'domain': {'id': '131', 'name': 'Unified Twitter Taxonomy', 'description': 'A taxonomy of user interests. '}, 'entity': {'id': '1526278121527205889', 'name': '2022 United States midterm elections'}}]",
2022-11-12 04:16:51+00:00,1591283860096307200,"Friday’s count is done and we’re beating Joe Kent by 4,959 votes. Nearly all of the remaining ballots in #WA03 will be counted tomorrow.

Joe Kent and I have both repeatedly pledged to accept the results of this election. That moment is coming soon.","[{'domain': {'id': '29', 'name': 'Events [Entity Service]', 'description': 'Real world events. '}, 'entity': {'id': '1526278121527205889', 'name': '2022 United States midterm elections'}}, {'domain': {'id': '38', 'name': 'Political Race', 'description': ''}, 'entity': {'id': '1526278121527205889', 'name': '2022 United States midterm elections'}}, {'domain': {'id': '131', 'name': 'Unified Twitter Taxonomy', 'description': 'A taxonomy of user interests. '}, 'entity': {'id': '847878884917886977', 'name': 'Politics', 'description': 'Politics'}}, {'domain': {'id': '131', 'name': 'Unified Twitter Taxonomy', 'description': 'A taxonomy of user interests. '}, 'entity': {'id': '1291447199595782144', 'name': 'United States politics'}}, {'domain': {'id': '131', 'name': 'Unified Twitter Taxonomy', 'description': 'A taxonomy of user interests. '}, 'entity': {'id': '1488973753274929152', 'name': 'Political events'}}, {'domain': {'id': '131', 'name': 'Unified Twitter Taxonomy', 'description': 'A taxonomy of user interests. '}, 'entity': {'id': '1518940645343125504', 'name': 'United States political events'}}, {'domain': {'id': '131', 'name': 'Unified Twitter Taxonomy', 'description': 'A taxonomy of user interests. '}, 'entity': {'id': '1526278121527205889', 'name': '2022 United States midterm elections'}}]",
2022-11-12 01:33:36+00:00,1591242775642910720,"On this Veterans Day I’m thankful for the service of patriots like my grandfather, Dale Gilmore, a paratrooper in the 82nd Airborne. Our freedom and our democracy require sacrifices and I’m grateful for those who have made them.","[{'domain': {'id': '29', 'name': 'Events [Entity Service]', 'description': 'Real world events. '}, 'entity': {'id': '1310576657866977280', 'name': 'Veterans Day ', 'description': 'This entity includes all conversations for all years for Veterans Day '}}, {'domain': {'id': '29', 'name': 'Events [Entity Service]', 'description': 'Real world events. '}, 'entity': {'id': '1526278121527205889', 'name': '2022 United States midterm elections'}}, {'domain': {'id': '38', 'name': 'Political Race', 'description': ''}, 'entity': {'id': '1526278121527205889', 'name': '2022 United States midterm elections'}}, {'domain': {'id': '131', 'name': 'Unified Twitter Taxonomy', 'description': 'A taxonomy of user interests. '}, 'entity': {'id': '847548225712119808', 'name': 'Holidays', 'description': 'Holidays'}}, {'domain': {'id': '131', 'name': 'Unified Twitter Taxonomy', 'description': 'A taxonomy of user interests. '}, 'entity': {'id': '847878884917886977', 'name': 'Politics', 'description': 'Politics'}}, {'domain': {'id': '131', 'name': 'Unified Twitter Taxonomy', 'description': 'A taxonomy of user interests. '}, 'entity': {'id': '1291447199595782144', 'name': 'United States politics'}}, {'domain': {'id': '131', 'name': 'Unified Twitter Taxonomy', 'description': 'A taxonomy of user interests. '}, 'entity': {'id': '1310576657866977280', 'name': 'Veterans Day ', 'description': 'This entity includes all conversations for all years for Veterans Day '}}, {'domain': {'id': '131', 'name': 'Unified Twitter Taxonomy', 'description': 'A taxonomy of user interests. '}, 'entity': {'id': '1436053202835689485', 'name': 'Events'}}, {'domain': {'id': '131', 'name': 'Unified Twitter Taxonomy', 'description': 'A taxonomy of user interests. '}, 'entity': {'id': '1488973753274929152', 'name': 'Political events'}}, {'domain': {'id': '131', 'name': 'Unified Twitter Taxonomy', 'description': 'A taxonomy of user interests. '}, 'entity': {'id': '1518940645343125504', 'name': 'United States political events'}}, {'domain': {'id': '131', 'name': 'Unified Twitter Taxonomy', 'description': 'A taxonomy of user interests. '}, 'entity': {'id': '1526278121527205889', 'name': '2022 United States midterm elections'}}, {'domain': {'id': '65', 'name': 'Interests and Hobbies Vertical', 'description': 'Top level interests and hobbies groupings, like Food or Travel'}, 'entity': {'id': '864925500627484672', 'name': 'Family and life stages', 'description': 'Family and Life Stages'}}, {'domain': {'id': '66', 'name': 'Interests and Hobbies Category', 'description': 'A grouping of interests and hobbies entities, like Novelty Food or Destinations'}, 'entity': {'id': '847546079042093056', 'name': 'Veterans', 'description': 'Veterans'}}]",
2022-11-11 04:10:53+00:00,1590919970342723584,"Today’s count is done and we’re beating Joe Kent by 5,882 votes. 4 out of 5 remaining ballots are in Clark County where we lead 57% to 43%.

Joe Kent has repeatedly stated he’ll accept the result of this election, win or lose. So have I, and I look forward to a smooth transition.","[{'domain': {'id': '29', 'name': 'Events [Entity Service]', 'description': 'Real world events. '}, 'entity': {'id': '1526278121527205889', 'name': '2022 United States midterm elections'}}, {'domain': {'id': '38', 'name': 'Political Race', 'description': ''}, 'entity': {'id': '1526278121527205889', 'name': '2022 United States midterm elections'}}, {'domain': {'id': '131', 'name': 'Unified Twitter Taxonomy', 'description': 'A taxonomy of user interests. '}, 'entity': {'id': '847878884917886977', 'name': 'Politics', 'description': 'Politics'}}, {'domain': {'id': '131', 'name': 'Unified Twitter Taxonomy', 'description': 'A taxonomy of user interests. '}, 'entity': {'id': '1291447199595782144', 'name': 'United States politics'}}, {'domain': {'id': '131', 'name': 'Unified Twitter Taxonomy', 'description': 'A taxonomy of user interests. '}, 'entity': {'id': '1488973753274929152', 'name': 'Political events'}}, {'domain': {'id': '131', 'name': 'Unified Twitter Taxonomy', 'description': 'A taxonomy of user interests. '}, 'entity': {'id': '1518940645343125504', 'name': 'United States political events'}}, {'domain': {'id': '131', 'name': 'Unified Twitter Taxonomy', 'description': 'A taxonomy of user interests. '}, 'entity': {'id': '1526278121527205889', 'name': '2022 United States midterm elections'}}]",
2022-11-10 03:49:26+00:00,1590552183812288512,It’ll take several more days to complete the count. Hang in there. https://t.co/9jVbQBBLqV,"[{'domain': {'id': '29', 'name': 'Events [Entity Service]', 'description': 'Real world events. '}, 'entity': {'id': '1526278121527205889', 'name': '2022 United States midterm elections'}}, {'domain': {'id': '38', 'name': 'Political Race', 'description': ''}, 'entity': {'id': '1526278121527205889', 'name': '2022 United States midterm elections'}}, {'domain': {'id': '131', 'name': 'Unified Twitter Taxonomy', 'description': 'A taxonomy of user interests. '}, 'entity': {'id': '847878884917886977', 'name': 'Politics', 'description': 'Politics'}}, {'domain': {'id': '131', 'name': 'Unified Twitter Taxonomy', 'description': 'A taxonomy of user interests. '}, 'entity': {'id': '1291447199595782144', 'name': 'United States politics'}}, {'domain': {'id': '131', 'name': 'Unified Twitter Taxonomy', 'description': 'A taxonomy of user interests. '}, 'entity': {'id': '1488973753274929152', 'name': 'Political events'}}, {'domain': {'id': '131', 'name': 'Unified Twitter Taxonomy', 'description': 'A taxonomy of user interests. '}, 'entity': {'id': '1518940645343125504', 'name': 'United States political events'}}, {'domain': {'id': '131', 'name': 'Unified Twitter Taxonomy', 'description': 'A taxonomy of user interests. '}, 'entity': {'id': '1526278121527205889', 'name': '2022 United States midterm elections'}}]",
2022-11-10 03:49:23+00:00,1590552173959868419,"Another day of counting is done and we’re still beating Joe Kent by more than 10,000 votes.

Thank you to the elections administrators in #WA03 who are working hard to count every vote. Vote-by-mail is safe, secure, and accessible because of you.","[{'domain': {'id': '29', 'name': 'Events [Entity Service]', 'description': 'Real world events. '}, 'entity': {'id': '1526278121527205889', 'name': '2022 United States midterm elections'}}, {'domain': {'id': '38', 'name': 'Political Race', 'description': ''}, 'entity': {'id': '1526278121527205889', 'name': '2022 United States midterm elections'}}, {'domain': {'id': '131', 'name': 'Unified Twitter Taxonomy', 'description': 'A taxonomy of user interests. '}, 'entity': {'id': '847878884917886977', 'name': 'Politics', 'description': 'Politics'}}, {'domain': {'id': '131', 'name': 'Unified Twitter Taxonomy', 'description': 'A taxonomy of user interests. '}, 'entity': {'id': '1291447199595782144', 'name': 'United States politics'}}, {'domain': {'id': '131', 'name': 'Unified Twitter Taxonomy', 'description': 'A taxonomy of user interests. '}, 'entity': {'id': '1488973753274929152', 'name': 'Political events'}}, {'domain': {'id': '131', 'name': 'Unified Twitter Taxonomy', 'description': 'A taxonomy of user interests. '}, 'entity': {'id': '1518940645343125504', 'name': 'United States political events'}}, {'domain': {'id': '131', 'name': 'Unified Twitter Taxonomy', 'description': 'A taxonomy of user interests. '}, 'entity': {'id': '1526278121527205889', 'name': '2022 United States midterm elections'}}]",
2022-11-09 20:53:10+00:00,1590447429597683712,"Thanks for inviting me on, @GeeScottSr. I’m feeling hopeful today too. Come visit Southwest Washington anytime. https://t.co/nHKmiI5vqE","[{'domain': {'id': '29', 'name': 'Events [Entity Service]', 'description': 'Real world events. '}, 'entity': {'id': '1526278121527205889', 'name': '2022 United States midterm elections'}}, {'domain': {'id': '38', 'name': 'Political Race', 'description': ''}, 'entity': {'id': '1526278121527205889', 'name': '2022 United States midterm elections'}}, {'domain': {'id': '131', 'name': 'Unified Twitter Taxonomy', 'description': 'A taxonomy of user interests. '}, 'entity': {'id': '847878884917886977', 'name': 'Politics', 'description': 'Politics'}}, {'domain': {'id': '131', 'name': 'Unified Twitter Taxonomy', 'description': 'A taxonomy of user interests. '}, 'entity': {'id': '1291447199595782144', 'name': 'United States politics'}}, {'domain': {'id': '131', 'name': 'Unified Twitter Taxonomy', 'description': 'A taxonomy of user interests. '}, 'entity': {'id': '1488973753274929152', 'name': 'Political events'}}, {'domain': {'id': '131', 'name': 'Unified Twitter Taxonomy', 'description': 'A taxonomy of user interests. '}, 'entity': {'id': '1518940645343125504', 'name': 'United States political events'}}, {'domain': {'id': '131', 'name': 'Unified Twitter Taxonomy', 'description': 'A taxonomy of user interests. '}, 'entity': {'id': '1526278121527205889', 'name': '2022 United States midterm elections'}}]",
2022-11-09 05:22:26+00:00,1590213200574058497,Thank you also to our election workers who will continue verifying signatures and counting tens of thousands more ballots in the days to come. You are patriots who deserve the respect and appreciation of every candidate for public office.,"[{'domain': {'id': '29', 'name': 'Events [Entity Service]', 'description': 'Real world events. '}, 'entity': {'id': '1526278121527205889', 'name': '2022 United States midterm elections'}}, {'domain': {'id': '38', 'name': 'Political Race', 'description': ''}, 'entity': {'id': '1526278121527205889', 'name': '2022 United States midterm elections'}}, {'domain': {'id': '131', 'name': 'Unified Twitter Taxonomy', 'description': 'A taxonomy of user interests. '}, 'entity': {'id': '847878884917886977', 'name': 'Politics', 'description': 'Politics'}}, {'domain': {'id': '131', 'name': 'Unified Twitter Taxonomy', 'description': 'A taxonomy of user interests. '}, 'entity': {'id': '1291447199595782144', 'name': 'United States politics'}}, {'domain': {'id': '131', 'name': 'Unified Twitter Taxonomy', 'description': 'A taxonomy of user interests. '}, 'entity': {'id': '1488973753274929152', 'name': 'Political events'}}, {'domain': {'id': '131', 'name': 'Unified Twitter Taxonomy', 'description': 'A taxonomy of user interests. '}, 'entity': {'id': '1518940645343125504', 'name': 'United States political events'}}, {'domain': {'id': '131', 'name': 'Unified Twitter Taxonomy', 'description': 'A taxonomy of user interests. '}, 'entity': {'id': '1526278121527205889', 'name': '2022 United States midterm elections'}}]",
2022-11-09 05:21:21+00:00,1590212930112720896,"All 7 counties in #WA03 are done reporting tonight. We’re beating Joe Kent 53% - 47%, a margin of over 11,000 votes.

It’ll take a few days to know the result, but we already know this: democracy and working families are always worth fighting for. Thank you, thank you, thank you.","[{'domain': {'id': '29', 'name': 'Events [Entity Service]', 'description': 'Real world events. '}, 'entity': {'id': '1526278121527205889', 'name': '2022 United States midterm elections'}}, {'domain': {'id': '38', 'name': 'Political Race', 'description': ''}, 'entity': {'id': '1526278121527205889', 'name': '2022 United States midterm elections'}}, {'domain': {'id': '131', 'name': 'Unified Twitter Taxonomy', 'description': 'A taxonomy of user interests. '}, 'entity': {'id': '847878884917886977', 'name': 'Politics', 'description': 'Politics'}}, {'domain': {'id': '131', 'name': 'Unified Twitter Taxonomy', 'description': 'A taxonomy of user interests. '}, 'entity': {'id': '1291447199595782144', 'name': 'United States politics'}}, {'domain': {'id': '131', 'name': 'Unified Twitter Taxonomy', 'description': 'A taxonomy of user interests. '}, 'entity': {'id': '1488973753274929152', 'name': 'Political events'}}, {'domain': {'id': '131', 'name': 'Unified Twitter Taxonomy', 'description': 'A taxonomy of user interests. '}, 'entity': {'id': '1518940645343125504', 'name': 'United States political events'}}, {'domain': {'id': '131', 'name': 'Unified Twitter Taxonomy', 'description': 'A taxonomy of user interests. '}, 'entity': {'id': '1526278121527205889', 'name': '2022 United States midterm elections'}}]",
2022-11-09 01:11:47+00:00,1590150122209701888,Thank you to everyone making calls in person &amp; virtually. We’ll be phonebanking all evening to make sure voters get their ballots in. It’s not too late to chip in and make a difference in this election. Sign up here: https://t.co/t9oG2Smacw https://t.co/2FgNb5UkMs,"[{'domain': {'id': '29', 'name': 'Events [Entity Service]', 'description': 'Real world events. '}, 'entity': {'id': '1526278121527205889', 'name': '2022 United States midterm elections'}}, {'domain': {'id': '38', 'name': 'Political Race', 'description': ''}, 'entity': {'id': '1526278121527205889', 'name': '2022 United States midterm elections'}}, {'domain': {'id': '131', 'name': 'Unified Twitter Taxonomy', 'description': 'A taxonomy of user interests. '}, 'entity': {'id': '847878884917886977', 'name': 'Politics', 'description': 'Politics'}}, {'domain': {'id': '131', 'name': 'Unified Twitter Taxonomy', 'description': 'A taxonomy of user interests. '}, 'entity': {'id': '1291447199595782144', 'name': 'United States politics'}}, {'domain': {'id': '131', 'name': 'Unified Twitter Taxonomy', 'description': 'A taxonomy of user interests. '}, 'entity': {'id': '1488973753274929152', 'name': 'Political events'}}, {'domain': {'id': '131', 'name': 'Unified Twitter Taxonomy', 'description': 'A taxonomy of user interests. '}, 'entity': {'id': '1518940645343125504', 'name': 'United States political events'}}, {'domain': {'id': '131', 'name': 'Unified Twitter Taxonomy', 'description': 'A taxonomy of user interests. '}, 'entity': {'id': '1526278121527205889', 'name': '2022 United States midterm elections'}}]",
2022-11-08 23:42:01+00:00,1590127533613539329,"From Pacific County, to my home in Skamania and everywhere in between, voters have stood up for women, working families, and our democracy.

Today is when we bring our hard work home. Get your ballots in before 8 pm tonight so we can win this thing! https://t.co/Z3T6Uc15hf","[{'domain': {'id': '29', 'name': 'Events [Entity Service]', 'description': 'Real world events. '}, 'entity': {'id': '1526278121527205889', 'name': '2022 United States midterm elections'}}, {'domain': {'id': '38', 'name': 'Political Race', 'description': ''}, 'entity': {'id': '1526278121527205889', 'name': '2022 United States midterm elections'}}, {'domain': {'id': '131', 'name': 'Unified Twitter Taxonomy', 'description': 'A taxonomy of user interests. '}, 'entity': {'id': '847878884917886977', 'name': 'Politics', 'description': 'Politics'}}, {'domain': {'id': '131', 'name': 'Unified Twitter Taxonomy', 'description': 'A taxonomy of user interests. '}, 'entity': {'id': '1291447199595782144', 'name': 'United States politics'}}, {'domain': {'id': '131', 'name': 'Unified Twitter Taxonomy', 'description': 'A taxonomy of user interests. '}, 'entity': {'id': '1488973753274929152', 'name': 'Political events'}}, {'domain': {'id': '131', 'name': 'Unified Twitter Taxonomy', 'description': 'A taxonomy of user interests. '}, 'entity': {'id': '1518940645343125504', 'name': 'United States political events'}}, {'domain': {'id': '131', 'name': 'Unified Twitter Taxonomy', 'description': 'A taxonomy of user interests. '}, 'entity': {'id': '1526278121527205889', 'name': '2022 United States midterm elections'}}]",
2022-11-08 21:40:31+00:00,1590096954247479296,We’ll be making calls online &amp; in person starting at 4:00 pm to get those last votes in. I hope you can join! Sign up for both here: https://t.co/4ihF9l4yY4,"[{'domain': {'id': '29', 'name': 'Events [Entity Service]', 'description': 'Real world events. '}, 'entity': {'id': '1526278121527205889', 'name': '2022 United States midterm elections'}}, {'domain': {'id': '38', 'name': 'Political Race', 'description': ''}, 'entity': {'id': '1526278121527205889', 'name': '2022 United States midterm elections'}}, {'domain': {'id': '131', 'name': 'Unified Twitter Taxonomy', 'description': 'A taxonomy of user interests. '}, 'entity': {'id': '847878884917886977', 'name': 'Politics', 'description': 'Politics'}}, {'domain': {'id': '131', 'name': 'Unified Twitter Taxonomy', 'description': 'A taxonomy of user interests. '}, 'entity': {'id': '1291447199595782144', 'name': 'United States politics'}}, {'domain': {'id': '131', 'name': 'Unified Twitter Taxonomy', 'description': 'A taxonomy of user interests. '}, 'entity': {'id': '1488973753274929152', 'name': 'Political events'}}, {'domain': {'id': '131', 'name': 'Unified Twitter Taxonomy', 'description': 'A taxonomy of user interests. '}, 'entity': {'id': '1518940645343125504', 'name': 'United States political events'}}, {'domain': {'id': '131', 'name': 'Unified Twitter Taxonomy', 'description': 'A taxonomy of user interests. '}, 'entity': {'id': '1526278121527205889', 'name': '2022 United States midterm elections'}}]",
