created_at,id,text,context_annotations,geo
2022-11-02 00:34:33+00:00,1587604038811799552,"Joe Kent would be a disaster for us all, and right now the only person standing in his way is me.

Help us reach voters in every corner of the district by Election Day: https://t.co/iQsEmAa5kB https://t.co/et5kOFE0Or","[{'domain': {'id': '29', 'name': 'Events [Entity Service]', 'description': 'Real world events. '}, 'entity': {'id': '1526278121527205889', 'name': '2022 United States midterm elections'}}, {'domain': {'id': '38', 'name': 'Political Race', 'description': ''}, 'entity': {'id': '1526278121527205889', 'name': '2022 United States midterm elections'}}, {'domain': {'id': '131', 'name': 'Unified Twitter Taxonomy', 'description': 'A taxonomy of user interests. '}, 'entity': {'id': '847878884917886977', 'name': 'Politics', 'description': 'Politics'}}, {'domain': {'id': '131', 'name': 'Unified Twitter Taxonomy', 'description': 'A taxonomy of user interests. '}, 'entity': {'id': '1291447199595782144', 'name': 'United States politics'}}, {'domain': {'id': '131', 'name': 'Unified Twitter Taxonomy', 'description': 'A taxonomy of user interests. '}, 'entity': {'id': '1488973753274929152', 'name': 'Political events'}}, {'domain': {'id': '131', 'name': 'Unified Twitter Taxonomy', 'description': 'A taxonomy of user interests. '}, 'entity': {'id': '1518940645343125504', 'name': 'United States political events'}}, {'domain': {'id': '131', 'name': 'Unified Twitter Taxonomy', 'description': 'A taxonomy of user interests. '}, 'entity': {'id': '1526278121527205889', 'name': '2022 United States midterm elections'}}]",
2022-11-01 21:29:10+00:00,1587557384918302720,"Election Day is one week away! This is not a race that you want to sit in the back seat and observe. There is far too much at stake. 

There is still time to make a difference. Don’t watch the news a week from today and wish you had done more. Sign up now: https://t.co/4ihF9l4yY4","[{'domain': {'id': '29', 'name': 'Events [Entity Service]', 'description': 'Real world events. '}, 'entity': {'id': '1526278121527205889', 'name': '2022 United States midterm elections'}}, {'domain': {'id': '38', 'name': 'Political Race', 'description': ''}, 'entity': {'id': '1526278121527205889', 'name': '2022 United States midterm elections'}}, {'domain': {'id': '131', 'name': 'Unified Twitter Taxonomy', 'description': 'A taxonomy of user interests. '}, 'entity': {'id': '847878884917886977', 'name': 'Politics', 'description': 'Politics'}}, {'domain': {'id': '131', 'name': 'Unified Twitter Taxonomy', 'description': 'A taxonomy of user interests. '}, 'entity': {'id': '1291447199595782144', 'name': 'United States politics'}}, {'domain': {'id': '131', 'name': 'Unified Twitter Taxonomy', 'description': 'A taxonomy of user interests. '}, 'entity': {'id': '1488973753274929152', 'name': 'Political events'}}, {'domain': {'id': '131', 'name': 'Unified Twitter Taxonomy', 'description': 'A taxonomy of user interests. '}, 'entity': {'id': '1518940645343125504', 'name': 'United States political events'}}, {'domain': {'id': '131', 'name': 'Unified Twitter Taxonomy', 'description': 'A taxonomy of user interests. '}, 'entity': {'id': '1526278121527205889', 'name': '2022 United States midterm elections'}}]",
2022-11-01 19:15:43+00:00,1587523801134551041,"While political violence and threats against nonpartisan election workers are on the rise, Joe Kent thinks everyone should have access to military-grade weapons. Joe Kent has also said he believes there is a war happening in the U.S.

Believe him when he says these things. https://t.co/mOFSrKYGpU","[{'domain': {'id': '29', 'name': 'Events [Entity Service]', 'description': 'Real world events. '}, 'entity': {'id': '1526278121527205889', 'name': '2022 United States midterm elections'}}, {'domain': {'id': '38', 'name': 'Political Race', 'description': ''}, 'entity': {'id': '1526278121527205889', 'name': '2022 United States midterm elections'}}, {'domain': {'id': '131', 'name': 'Unified Twitter Taxonomy', 'description': 'A taxonomy of user interests. '}, 'entity': {'id': '847878884917886977', 'name': 'Politics', 'description': 'Politics'}}, {'domain': {'id': '131', 'name': 'Unified Twitter Taxonomy', 'description': 'A taxonomy of user interests. '}, 'entity': {'id': '1291447199595782144', 'name': 'United States politics'}}, {'domain': {'id': '131', 'name': 'Unified Twitter Taxonomy', 'description': 'A taxonomy of user interests. '}, 'entity': {'id': '1488973753274929152', 'name': 'Political events'}}, {'domain': {'id': '131', 'name': 'Unified Twitter Taxonomy', 'description': 'A taxonomy of user interests. '}, 'entity': {'id': '1518940645343125504', 'name': 'United States political events'}}, {'domain': {'id': '131', 'name': 'Unified Twitter Taxonomy', 'description': 'A taxonomy of user interests. '}, 'entity': {'id': '1526278121527205889', 'name': '2022 United States midterm elections'}}]",
2022-11-01 03:14:21+00:00,1587281864804683776,Winona Ryder here wishing you a Happy Halloween 🎃 https://t.co/s6UOlXqIWu,"[{'domain': {'id': '10', 'name': 'Person', 'description': 'Named people in the world like Nelson Mandela'}, 'entity': {'id': '930537387620364288', 'name': 'Winona Ryder', 'description': 'Winona Ryder'}}, {'domain': {'id': '29', 'name': 'Events [Entity Service]', 'description': 'Real world events. '}, 'entity': {'id': '1301463450099482625', 'name': 'Halloween ', 'description': 'This entity includes all conversations for Halloween for all years'}}, {'domain': {'id': '29', 'name': 'Events [Entity Service]', 'description': 'Real world events. '}, 'entity': {'id': '1526278121527205889', 'name': '2022 United States midterm elections'}}, {'domain': {'id': '38', 'name': 'Political Race', 'description': ''}, 'entity': {'id': '1526278121527205889', 'name': '2022 United States midterm elections'}}, {'domain': {'id': '56', 'name': 'Actor', 'description': 'An actor or actress in the world, like Kate Winslet or Leonardo DiCaprio'}, 'entity': {'id': '930537387620364288', 'name': 'Winona Ryder', 'description': 'Winona Ryder'}}, {'domain': {'id': '131', 'name': 'Unified Twitter Taxonomy', 'description': 'A taxonomy of user interests. '}, 'entity': {'id': '847878884917886977', 'name': 'Politics', 'description': 'Politics'}}, {'domain': {'id': '131', 'name': 'Unified Twitter Taxonomy', 'description': 'A taxonomy of user interests. '}, 'entity': {'id': '930537387620364288', 'name': 'Winona Ryder', 'description': 'Winona Ryder'}}, {'domain': {'id': '131', 'name': 'Unified Twitter Taxonomy', 'description': 'A taxonomy of user interests. '}, 'entity': {'id': '1291095284756357120', 'name': 'Cultural events'}}, {'domain': {'id': '131', 'name': 'Unified Twitter Taxonomy', 'description': 'A taxonomy of user interests. '}, 'entity': {'id': '1291447199595782144', 'name': 'United States politics'}}, {'domain': {'id': '131', 'name': 'Unified Twitter Taxonomy', 'description': 'A taxonomy of user interests. '}, 'entity': {'id': '1296394094009151488', 'name': 'Halloween'}}, {'domain': {'id': '131', 'name': 'Unified Twitter Taxonomy', 'description': 'A taxonomy of user interests. '}, 'entity': {'id': '1436053202835689485', 'name': 'Events'}}, {'domain': {'id': '131', 'name': 'Unified Twitter Taxonomy', 'description': 'A taxonomy of user interests. '}, 'entity': {'id': '1488973753274929152', 'name': 'Political events'}}, {'domain': {'id': '131', 'name': 'Unified Twitter Taxonomy', 'description': 'A taxonomy of user interests. '}, 'entity': {'id': '1518940645343125504', 'name': 'United States political events'}}, {'domain': {'id': '131', 'name': 'Unified Twitter Taxonomy', 'description': 'A taxonomy of user interests. '}, 'entity': {'id': '1526278121527205889', 'name': '2022 United States midterm elections'}}]",
2022-10-31 22:57:55+00:00,1587217330924564480,Happy Halloween 🎃 Need a last-minute costume idea? https://t.co/NrAWytHq75,"[{'domain': {'id': '29', 'name': 'Events [Entity Service]', 'description': 'Real world events. '}, 'entity': {'id': '1301463450099482625', 'name': 'Halloween ', 'description': 'This entity includes all conversations for Halloween for all years'}}, {'domain': {'id': '29', 'name': 'Events [Entity Service]', 'description': 'Real world events. '}, 'entity': {'id': '1526278121527205889', 'name': '2022 United States midterm elections'}}, {'domain': {'id': '38', 'name': 'Political Race', 'description': ''}, 'entity': {'id': '1526278121527205889', 'name': '2022 United States midterm elections'}}, {'domain': {'id': '131', 'name': 'Unified Twitter Taxonomy', 'description': 'A taxonomy of user interests. '}, 'entity': {'id': '847878884917886977', 'name': 'Politics', 'description': 'Politics'}}, {'domain': {'id': '131', 'name': 'Unified Twitter Taxonomy', 'description': 'A taxonomy of user interests. '}, 'entity': {'id': '1291095284756357120', 'name': 'Cultural events'}}, {'domain': {'id': '131', 'name': 'Unified Twitter Taxonomy', 'description': 'A taxonomy of user interests. '}, 'entity': {'id': '1291447199595782144', 'name': 'United States politics'}}, {'domain': {'id': '131', 'name': 'Unified Twitter Taxonomy', 'description': 'A taxonomy of user interests. '}, 'entity': {'id': '1296394094009151488', 'name': 'Halloween'}}, {'domain': {'id': '131', 'name': 'Unified Twitter Taxonomy', 'description': 'A taxonomy of user interests. '}, 'entity': {'id': '1436053202835689485', 'name': 'Events'}}, {'domain': {'id': '131', 'name': 'Unified Twitter Taxonomy', 'description': 'A taxonomy of user interests. '}, 'entity': {'id': '1488973753274929152', 'name': 'Political events'}}, {'domain': {'id': '131', 'name': 'Unified Twitter Taxonomy', 'description': 'A taxonomy of user interests. '}, 'entity': {'id': '1518940645343125504', 'name': 'United States political events'}}, {'domain': {'id': '131', 'name': 'Unified Twitter Taxonomy', 'description': 'A taxonomy of user interests. '}, 'entity': {'id': '1526278121527205889', 'name': '2022 United States midterm elections'}}, {'domain': {'id': '29', 'name': 'Events [Entity Service]', 'description': 'Real world events. '}, 'entity': {'id': '1585398799182094336', 'name': 'Happy Halloween! 🎃', 'description': 'The following Tweets are part of a live conversation detected by an algorithm. '}}]",
2022-10-31 21:32:32+00:00,1587195842846658561,"Rural downtowns are the backbones of rural communities. I’m proud of the work I did to support small businesses as Executive Director of the Stevenson Downtown Association.

You can trust I will show up for this district because I have a record of showing up for my community. https://t.co/9VhJUK9HTH","[{'domain': {'id': '29', 'name': 'Events [Entity Service]', 'description': 'Real world events. '}, 'entity': {'id': '1526278121527205889', 'name': '2022 United States midterm elections'}}, {'domain': {'id': '38', 'name': 'Political Race', 'description': ''}, 'entity': {'id': '1526278121527205889', 'name': '2022 United States midterm elections'}}, {'domain': {'id': '131', 'name': 'Unified Twitter Taxonomy', 'description': 'A taxonomy of user interests. '}, 'entity': {'id': '847878884917886977', 'name': 'Politics', 'description': 'Politics'}}, {'domain': {'id': '131', 'name': 'Unified Twitter Taxonomy', 'description': 'A taxonomy of user interests. '}, 'entity': {'id': '1291447199595782144', 'name': 'United States politics'}}, {'domain': {'id': '131', 'name': 'Unified Twitter Taxonomy', 'description': 'A taxonomy of user interests. '}, 'entity': {'id': '1407811550987972617', 'name': 'Industries'}}, {'domain': {'id': '131', 'name': 'Unified Twitter Taxonomy', 'description': 'A taxonomy of user interests. '}, 'entity': {'id': '1488973753274929152', 'name': 'Political events'}}, {'domain': {'id': '131', 'name': 'Unified Twitter Taxonomy', 'description': 'A taxonomy of user interests. '}, 'entity': {'id': '1518940645343125504', 'name': 'United States political events'}}, {'domain': {'id': '131', 'name': 'Unified Twitter Taxonomy', 'description': 'A taxonomy of user interests. '}, 'entity': {'id': '1526278121527205889', 'name': '2022 United States midterm elections'}}]",
2022-10-31 20:04:46+00:00,1587173754689720320,"Join me tomorrow night for our One Week To Go campaign rally. With me will be Clark County native, Lt. Gov. Denny Heck!

Can’t wait to see you there.
https://t.co/Kyd8t09oWj","[{'domain': {'id': '10', 'name': 'Person', 'description': 'Named people in the world like Nelson Mandela'}, 'entity': {'id': '998659518694211584', 'name': 'Denny Heck', 'description': 'US Representative Denny Heck (WA-10)'}}, {'domain': {'id': '29', 'name': 'Events [Entity Service]', 'description': 'Real world events. '}, 'entity': {'id': '1526278121527205889', 'name': '2022 United States midterm elections'}}, {'domain': {'id': '35', 'name': 'Politician', 'description': 'Politicians in the world, like Joe Biden'}, 'entity': {'id': '998659518694211584', 'name': 'Denny Heck', 'description': 'US Representative Denny Heck (WA-10)'}}, {'domain': {'id': '38', 'name': 'Political Race', 'description': ''}, 'entity': {'id': '1526278121527205889', 'name': '2022 United States midterm elections'}}, {'domain': {'id': '131', 'name': 'Unified Twitter Taxonomy', 'description': 'A taxonomy of user interests. '}, 'entity': {'id': '847878884917886977', 'name': 'Politics', 'description': 'Politics'}}, {'domain': {'id': '131', 'name': 'Unified Twitter Taxonomy', 'description': 'A taxonomy of user interests. '}, 'entity': {'id': '998659518694211584', 'name': 'Denny Heck', 'description': 'US Representative Denny Heck (WA-10)'}}, {'domain': {'id': '131', 'name': 'Unified Twitter Taxonomy', 'description': 'A taxonomy of user interests. '}, 'entity': {'id': '1070032753834438656', 'name': 'Political figures', 'description': 'Politician'}}, {'domain': {'id': '131', 'name': 'Unified Twitter Taxonomy', 'description': 'A taxonomy of user interests. '}, 'entity': {'id': '1291447199595782144', 'name': 'United States politics'}}, {'domain': {'id': '131', 'name': 'Unified Twitter Taxonomy', 'description': 'A taxonomy of user interests. '}, 'entity': {'id': '1488973753274929152', 'name': 'Political events'}}, {'domain': {'id': '131', 'name': 'Unified Twitter Taxonomy', 'description': 'A taxonomy of user interests. '}, 'entity': {'id': '1518940645343125504', 'name': 'United States political events'}}, {'domain': {'id': '131', 'name': 'Unified Twitter Taxonomy', 'description': 'A taxonomy of user interests. '}, 'entity': {'id': '1526278121527205889', 'name': '2022 United States midterm elections'}}]",
2022-10-31 17:07:23+00:00,1587129117820223488,"Joe Kent believes in ghost stories 👻 like the “Big Lie” about the 2020 presidential election… and he wants to eliminate mail-in voting. If elected, he would undermine legitimate elections and threaten the future of democracy. https://t.co/65VxGD38Aa","[{'domain': {'id': '29', 'name': 'Events [Entity Service]', 'description': 'Real world events. '}, 'entity': {'id': '1526278121527205889', 'name': '2022 United States midterm elections'}}, {'domain': {'id': '38', 'name': 'Political Race', 'description': ''}, 'entity': {'id': '1526278121527205889', 'name': '2022 United States midterm elections'}}, {'domain': {'id': '67', 'name': 'Interests and Hobbies', 'description': 'Interests, opinions, and behaviors of individuals, groups, or cultures; like Speciality Cooking or Theme Parks'}, 'entity': {'id': '1278071502840066048', 'name': 'Paranormal'}}, {'domain': {'id': '131', 'name': 'Unified Twitter Taxonomy', 'description': 'A taxonomy of user interests. '}, 'entity': {'id': '847878884917886977', 'name': 'Politics', 'description': 'Politics'}}, {'domain': {'id': '131', 'name': 'Unified Twitter Taxonomy', 'description': 'A taxonomy of user interests. '}, 'entity': {'id': '1278070750826557440', 'name': 'Unexplained phenomena'}}, {'domain': {'id': '131', 'name': 'Unified Twitter Taxonomy', 'description': 'A taxonomy of user interests. '}, 'entity': {'id': '1278071502840066048', 'name': 'Paranormal'}}, {'domain': {'id': '131', 'name': 'Unified Twitter Taxonomy', 'description': 'A taxonomy of user interests. '}, 'entity': {'id': '1291447199595782144', 'name': 'United States politics'}}, {'domain': {'id': '131', 'name': 'Unified Twitter Taxonomy', 'description': 'A taxonomy of user interests. '}, 'entity': {'id': '1488973753274929152', 'name': 'Political events'}}, {'domain': {'id': '131', 'name': 'Unified Twitter Taxonomy', 'description': 'A taxonomy of user interests. '}, 'entity': {'id': '1518940645343125504', 'name': 'United States political events'}}, {'domain': {'id': '131', 'name': 'Unified Twitter Taxonomy', 'description': 'A taxonomy of user interests. '}, 'entity': {'id': '1526278121527205889', 'name': '2022 United States midterm elections'}}]",
2022-10-31 03:22:49+00:00,1586921606877941762,"When we started this campaign we had less than a 100 followers.

Today, our people powered movement has grown by tens of thousands online. It’s going to take every one of us to get across the finish line.

We can’t stop here. Share our movement to help us keep growing! https://t.co/Kdvcx5Qhi8","[{'domain': {'id': '29', 'name': 'Events [Entity Service]', 'description': 'Real world events. '}, 'entity': {'id': '1526278121527205889', 'name': '2022 United States midterm elections'}}, {'domain': {'id': '38', 'name': 'Political Race', 'description': ''}, 'entity': {'id': '1526278121527205889', 'name': '2022 United States midterm elections'}}, {'domain': {'id': '131', 'name': 'Unified Twitter Taxonomy', 'description': 'A taxonomy of user interests. '}, 'entity': {'id': '847878884917886977', 'name': 'Politics', 'description': 'Politics'}}, {'domain': {'id': '131', 'name': 'Unified Twitter Taxonomy', 'description': 'A taxonomy of user interests. '}, 'entity': {'id': '1291447199595782144', 'name': 'United States politics'}}, {'domain': {'id': '131', 'name': 'Unified Twitter Taxonomy', 'description': 'A taxonomy of user interests. '}, 'entity': {'id': '1488973753274929152', 'name': 'Political events'}}, {'domain': {'id': '131', 'name': 'Unified Twitter Taxonomy', 'description': 'A taxonomy of user interests. '}, 'entity': {'id': '1518940645343125504', 'name': 'United States political events'}}, {'domain': {'id': '131', 'name': 'Unified Twitter Taxonomy', 'description': 'A taxonomy of user interests. '}, 'entity': {'id': '1526278121527205889', 'name': '2022 United States midterm elections'}}, {'domain': {'id': '159', 'name': 'States', 'description': 'States, provinces, or prefectures, like California or Fukushima Prefecture'}, 'entity': {'id': '1016385934814674944', 'name': 'Washington State', 'description': 'Washington'}}]",
2022-10-31 00:05:34+00:00,1586871966451257346,"Here’s the transcript: 

https://t.co/RzgLHGJsKM https://t.co/DOaYSAtZQo","[{'domain': {'id': '29', 'name': 'Events [Entity Service]', 'description': 'Real world events. '}, 'entity': {'id': '1526278121527205889', 'name': '2022 United States midterm elections'}}, {'domain': {'id': '38', 'name': 'Political Race', 'description': ''}, 'entity': {'id': '1526278121527205889', 'name': '2022 United States midterm elections'}}, {'domain': {'id': '131', 'name': 'Unified Twitter Taxonomy', 'description': 'A taxonomy of user interests. '}, 'entity': {'id': '847878884917886977', 'name': 'Politics', 'description': 'Politics'}}, {'domain': {'id': '131', 'name': 'Unified Twitter Taxonomy', 'description': 'A taxonomy of user interests. '}, 'entity': {'id': '1291447199595782144', 'name': 'United States politics'}}, {'domain': {'id': '131', 'name': 'Unified Twitter Taxonomy', 'description': 'A taxonomy of user interests. '}, 'entity': {'id': '1488973753274929152', 'name': 'Political events'}}, {'domain': {'id': '131', 'name': 'Unified Twitter Taxonomy', 'description': 'A taxonomy of user interests. '}, 'entity': {'id': '1518940645343125504', 'name': 'United States political events'}}, {'domain': {'id': '131', 'name': 'Unified Twitter Taxonomy', 'description': 'A taxonomy of user interests. '}, 'entity': {'id': '1526278121527205889', 'name': '2022 United States midterm elections'}}]",
2022-10-31 00:05:32+00:00,1586871958494654464,"Joe Kent wants to close all our borders to all immigration for the next 20 years in order to re-establish a white majority. His plan is economic sabotage and morally bankrupt, which is why he tries to hide from it on TV. https://t.co/wuqC08e2tq","[{'domain': {'id': '29', 'name': 'Events [Entity Service]', 'description': 'Real world events. '}, 'entity': {'id': '1526278121527205889', 'name': '2022 United States midterm elections'}}, {'domain': {'id': '38', 'name': 'Political Race', 'description': ''}, 'entity': {'id': '1526278121527205889', 'name': '2022 United States midterm elections'}}, {'domain': {'id': '131', 'name': 'Unified Twitter Taxonomy', 'description': 'A taxonomy of user interests. '}, 'entity': {'id': '847878884917886977', 'name': 'Politics', 'description': 'Politics'}}, {'domain': {'id': '131', 'name': 'Unified Twitter Taxonomy', 'description': 'A taxonomy of user interests. '}, 'entity': {'id': '1291447199595782144', 'name': 'United States politics'}}, {'domain': {'id': '131', 'name': 'Unified Twitter Taxonomy', 'description': 'A taxonomy of user interests. '}, 'entity': {'id': '1488973753274929152', 'name': 'Political events'}}, {'domain': {'id': '131', 'name': 'Unified Twitter Taxonomy', 'description': 'A taxonomy of user interests. '}, 'entity': {'id': '1518940645343125504', 'name': 'United States political events'}}, {'domain': {'id': '131', 'name': 'Unified Twitter Taxonomy', 'description': 'A taxonomy of user interests. '}, 'entity': {'id': '1526278121527205889', 'name': '2022 United States midterm elections'}}]",
2022-10-30 22:08:33+00:00,1586842520050618368,"Joe Kent says he's all about “Law &amp; Order” but wants to defund the FBI &amp; local police.

Says he's pro worker, but is anti union.

Says he loves democracy, but won’t accept the 2020 election results.

These mental gymnastics are gold medal worthy. 🥇","[{'domain': {'id': '29', 'name': 'Events [Entity Service]', 'description': 'Real world events. '}, 'entity': {'id': '1526278121527205889', 'name': '2022 United States midterm elections'}}, {'domain': {'id': '38', 'name': 'Political Race', 'description': ''}, 'entity': {'id': '1526278121527205889', 'name': '2022 United States midterm elections'}}, {'domain': {'id': '88', 'name': 'Political Body', 'description': 'A section of a government, like The Supreme Court'}, 'entity': {'id': '937710668706299904', 'name': 'Federal Bureau of Investigation', 'description': 'All conversation about the United States Federal Bureau of Investigation'}}, {'domain': {'id': '131', 'name': 'Unified Twitter Taxonomy', 'description': 'A taxonomy of user interests. '}, 'entity': {'id': '847878884917886977', 'name': 'Politics', 'description': 'Politics'}}, {'domain': {'id': '131', 'name': 'Unified Twitter Taxonomy', 'description': 'A taxonomy of user interests. '}, 'entity': {'id': '937710668706299904', 'name': 'Federal Bureau of Investigation', 'description': 'All conversation about the United States Federal Bureau of Investigation'}}, {'domain': {'id': '131', 'name': 'Unified Twitter Taxonomy', 'description': 'A taxonomy of user interests. '}, 'entity': {'id': '1068583660914266113', 'name': 'Government institutions', 'description': 'Political Body'}}, {'domain': {'id': '131', 'name': 'Unified Twitter Taxonomy', 'description': 'A taxonomy of user interests. '}, 'entity': {'id': '1291447199595782144', 'name': 'United States politics'}}, {'domain': {'id': '131', 'name': 'Unified Twitter Taxonomy', 'description': 'A taxonomy of user interests. '}, 'entity': {'id': '1488973753274929152', 'name': 'Political events'}}, {'domain': {'id': '131', 'name': 'Unified Twitter Taxonomy', 'description': 'A taxonomy of user interests. '}, 'entity': {'id': '1518940645343125504', 'name': 'United States political events'}}, {'domain': {'id': '131', 'name': 'Unified Twitter Taxonomy', 'description': 'A taxonomy of user interests. '}, 'entity': {'id': '1526278121527205889', 'name': '2022 United States midterm elections'}}]",
2022-10-30 20:59:43+00:00,1586825197554110464,"Thank you for writing this letter to the editor, Andrey. I support Ukraine in its fight for freedom and democracy. 🇺🇸🇺🇦 https://t.co/s1ExmvoEs2 https://t.co/zqmbckgldJ","[{'domain': {'id': '29', 'name': 'Events [Entity Service]', 'description': 'Real world events. '}, 'entity': {'id': '1526278121527205889', 'name': '2022 United States midterm elections'}}, {'domain': {'id': '38', 'name': 'Political Race', 'description': ''}, 'entity': {'id': '1526278121527205889', 'name': '2022 United States midterm elections'}}, {'domain': {'id': '131', 'name': 'Unified Twitter Taxonomy', 'description': 'A taxonomy of user interests. '}, 'entity': {'id': '847878884917886977', 'name': 'Politics', 'description': 'Politics'}}, {'domain': {'id': '131', 'name': 'Unified Twitter Taxonomy', 'description': 'A taxonomy of user interests. '}, 'entity': {'id': '1291447199595782144', 'name': 'United States politics'}}, {'domain': {'id': '131', 'name': 'Unified Twitter Taxonomy', 'description': 'A taxonomy of user interests. '}, 'entity': {'id': '1488973753274929152', 'name': 'Political events'}}, {'domain': {'id': '131', 'name': 'Unified Twitter Taxonomy', 'description': 'A taxonomy of user interests. '}, 'entity': {'id': '1518940645343125504', 'name': 'United States political events'}}, {'domain': {'id': '131', 'name': 'Unified Twitter Taxonomy', 'description': 'A taxonomy of user interests. '}, 'entity': {'id': '1526278121527205889', 'name': '2022 United States midterm elections'}}]",
